,Video_id,Title,Published_date,Views,Likes,Comments,Channel_Title,Month
0,8D_HbzZXy1I,Dealing With Heartbreaks Part 2 | Misunderstood The Assignment | Episode 3,2023-04-19,2806,131,10,BuzzFeed India,Apr
1,jHS7Ui_FV2c,Is anyone else as big of an SRK obsessed fan as Dhruv?,2023-04-18,6294,429,5,BuzzFeed India,Apr
2,-Ty_dbtMxws,Sushmit takes us through their celebration of Ambedkar Jayanti!,2023-04-16,2985,185,4,BuzzFeed India,Apr
3,AjyH15sG310,Taking Us Through Ambedkar Jayanti Celebrations is @thatgirlshruti,2023-04-15,4887,421,23,BuzzFeed India,Apr
4,EQ5tjp0humY,Ramzan Street Food Challenge | Iftar in Mumbai vs Bengaluru? | BuzzFeed India,2023-04-14,115237,4901,252,BuzzFeed India,Apr
5,75isOjJOW5Y,Moving Out Or Away Part 2 | Misunderstood The Assignment | Episode 1,2023-04-12,3707,149,9,BuzzFeed India,Apr
6,QiFW9ts6R80,We Ate Like Shahrukh Khan for a Day | BuzzFeed India,2023-04-07,184037,7749,165,BuzzFeed India,Apr
7,DBa3kABaFqg,Why Am I Losing My Friends? | Misunderstood The Assignment | Episode 7,2023-04-05,10773,466,28,BuzzFeed India,Apr
8,e-0RuCkT4ls,We Tasted Bengali Sweets For The First Time | BuzzFeed India,2023-03-31,119174,5695,288,BuzzFeed India,Mar
9,61WjJ9Pt3oQ,Identifying And Cutting Off Toxic People | Misunderstood The Assignment | Episode 6,2023-03-29,8328,324,17,BuzzFeed India,Mar
10,l21X8nj16pk,The Internet’s Boyfriend is back again! 🥵,2023-03-27,9066,315,3,BuzzFeed India,Mar
11,qyOV0LQReoo,It’s time we see a Bobby Deol x Suniel Shetty   ̶s̶h̶i̶r̶t̶l̶e̶s̶s̶ action packed movie! 👀,2023-03-26,8521,400,2,BuzzFeed India,Mar
12,cqjo9nbX3ow,We Let Chat GPT Decide What We Eat For A Day | BuzzFeed India,2023-03-24,167451,7965,158,BuzzFeed India,Mar
13,HPtOcjZ_zGg,Is this True? Or did Shreya make it up? 🤔,2023-03-23,18349,862,2,BuzzFeed India,Mar
14,0ZTR3ny2B8s,I Wish They Taught Me How To Do My Taxes In School | Misunderstood The Assignment | Episode 5,2023-03-22,9126,344,29,BuzzFeed India,Mar
15,0Bxsz1XfX_o,Did you guess any correctly? Or were you drooling the whole time? 🤤,2023-03-19,224028,11056,42,BuzzFeed India,Mar
16,bd4nXh76BFA,We Used Zomato Intercity To Swap Favourite Foods | BuzzFeed India,2023-03-17,162269,6772,128,BuzzFeed India,Mar
17,gzewHnJBONY,Breaking Away from Toxic Work Culture,2023-03-16,87649,6536,25,BuzzFeed India,Mar
18,5p1t4PDXGEE,Is Hustle Culture Worth It? Misunderstood The Assignment | Episode 4,2023-03-15,13069,531,22,BuzzFeed India,Mar
19,qmcXt_zBSD4,Team Hoe Phase or Team Solo Time? 👀,2023-03-14,20557,1027,3,BuzzFeed India,Mar
20,wdqpDSZB7Tg,We Tried The New Gourmet Menu From Dominos | BuzzFeed India,2023-03-10,199779,8055,281,BuzzFeed India,Mar
21,_bNt4jAYjdc,The 5 Stages of Heart Break  💔,2023-03-09,26427,975,4,BuzzFeed India,Mar
22,_ShBxmMnoFQ,Dealing With Heartbreaks | Misunderstood The Assignment | Episode 3,2023-03-08,16624,683,36,BuzzFeed India,Mar
23,xLSHxNz93hE,The Ranveer Singh one threw me off ngl. 👀,2023-03-07,287805,12830,16,BuzzFeed India,Mar
24,R39T7fz5pkE,Farhad was so real for this,2023-03-04,20820,1055,11,BuzzFeed India,Mar
25,5rIJGoMYzuk,Who Has The Best Mughlai Food Order? | BuzzFeed India,2023-03-03,269990,12359,305,BuzzFeed India,Mar
26,HkdSo0gB9Fc,Idk What Am I Doing In Life | Misunderstood The Assignment | Episode 2,2023-03-01,20388,886,50,BuzzFeed India,Mar
27,r-vvVgQyNEI,What are some crazy life saving tips you learnt when moving out? 👀,2023-02-28,238652,10008,14,BuzzFeed India,Feb
28,9146F4OLi6I,We Tried The Most Unpopular Items From The Baskin Robbins Menu | BuzzFeed India,2023-02-24,181727,7490,257,BuzzFeed India,Feb
29,j6jgQw-YJiM,Moving Out Or Away? | Misunderstood The Assignment | Episode 1,2023-02-22,46807,2394,94,BuzzFeed India,Feb
30,PEllTF7VfsE,Who Has The Best Bougie Food Order? | BuzzFeed India,2023-02-18,298938,12196,303,BuzzFeed India,Feb
31,GSh7mlLvN_Q,Frenemies Go On A Valentine's Day Date | BuzzFeed India,2023-02-11,202509,12150,304,BuzzFeed India,Feb
32,xUfDf1HnjGo,We Tried The Most Unpopular Items On The Faasos Menu | BuzzFeed India,2023-02-04,190156,7407,222,BuzzFeed India,Feb
33,dELyPZiHiD8,Value for Money Honey | Zara vs Calvin Klein vs Westside | BuzzFeed India,2023-02-01,82745,3456,86,BuzzFeed India,Feb
34,omuYuKIhQ3s,Who Has the Best 'Movie Time Snacks' Order? | BuzzFeed India,2023-01-28,253149,10650,291,BuzzFeed India,Jan
35,1cSVh5V78Lk,We Tasted The Most Unpopular Items On The KFC Menu | BuzzFeed India,2023-01-21,239216,10292,332,BuzzFeed India,Jan
36,mSk5fj1hA80,Taste Testing Weirdest Food Combinations We Could Find | BuzzFeed India,2023-01-14,209131,8021,307,BuzzFeed India,Jan
37,XbpW-meZyjI,"Who Has The Best 'New Year, New Me' Order | BuzzFeed India",2023-01-07,248018,10221,179,BuzzFeed India,Jan
38,cxKdcfvH5CY,BuzzFeed India Glitching One Last Time in 2022,2022-12-31,35528,1799,50,BuzzFeed India,Dec
39,bZaKs0G3re4,Mumbai vs Singapore Fashion Street Challenge | BuzzFeed India,2022-12-28,86333,3405,107,BuzzFeed India,Dec
40,1x4DCwH6g5Q,Can I Bake This Christmas Cake WITHOUT A Recipe? | @BakeWithShivesh | BuzzFeed India,2022-12-24,97639,4931,108,BuzzFeed India,Dec
41,NXicKTnxepA,I Tried Bizarre Viral Maggi Combos | BuzzFeed India,2022-12-17,116329,5163,173,BuzzFeed India,Dec
42,iHW4q_t-vQc,We Tasted The Most Unpopular Items On The Pizza Hut Menu | BuzzFeed India,2022-12-10,274670,9828,232,BuzzFeed India,Dec
43,KelBM2uULu4,We Tasted The Most Unpopular Items On The Burger King Menu | BuzzFeed India,2022-12-03,276626,10625,274,BuzzFeed India,Dec
44,4hyBchBq9r4,Non-Vegetarians Try Vegan Food For 24 Hours | BuzzFeed India,2022-11-26,364366,13195,282,BuzzFeed India,Nov
45,dlQUFzrnpKI,We Tasted The Most Unpopular Items On The Starbucks Menu | BuzzFeed India,2022-11-19,265327,10695,317,BuzzFeed India,Nov
46,Hxg5O7U_7W8,Who Has The Best Momo Order? | BuzzFeed India,2022-11-12,501730,16880,655,BuzzFeed India,Nov
47,Fysvmm54lcU,Men Face Their Biggest Fashion Fear | BuzzFeed India,2022-11-05,74767,3770,139,BuzzFeed India,Nov
48,Nhx5G-x5j_g,We Tasted Tamil Nadu Sweets For The First Time | BuzzFeed India,2022-10-29,415013,14025,506,BuzzFeed India,Oct
49,YyX4wi7byfQ,Can I Cook Better Than My Mom? | Diwali Episode | BuzzFeed India,2022-10-22,160274,6920,99,BuzzFeed India,Oct
50,6MM8Iy21_XE,USA v/s India Mystery Box Swap | BuzzFeed India,2022-10-15,186621,7718,119,BuzzFeed India,Oct
51,MIw1tHASpNM,Who Has The Best Indian-Chinese Food Order? | BuzzFeed India,2022-10-08,580373,22269,390,BuzzFeed India,Oct
52,5syoBYPiVaM,Diwali Inspired Diwali Fashion Challenge | BuzzFeed India,2022-10-01,126828,6198,159,BuzzFeed India,Oct
53,LnOZYFe9aLw,Who Has The Best Dosa Order? | BuzzFeed India,2022-09-24,447520,16728,604,BuzzFeed India,Sep
54,56xSFR-GC9I,Can We Remember All The Steps To This Recipe? | BuzzFeed India,2022-09-17,145801,6715,132,BuzzFeed India,Sep
55,9gp8BGSAwnI,We Tasted The Most Unpopular Items On The McDonald's Menu | BuzzFeed India,2022-09-10,341684,14074,358,BuzzFeed India,Sep
56,6J8QAvmdtps,Adults Choose Outfits From Their Parents’ Wardrobes | BuzzFeed India,2022-09-07,86858,4114,123,BuzzFeed India,Sep
57,Vx9iqJy6KRQ,I Pick A Best Friend Based On An Easy Snack Recipe | BuzzFeed India,2022-09-03,249115,11924,278,BuzzFeed India,Sep
58,zxiCMlibMN4,Who Has The Best Shaadi Order? | BuzzFeed India,2022-08-27,420272,16238,565,BuzzFeed India,Aug
59,7FQ1MmrI-nY,Can I Cook This Iconic Meal From Iran? | BuzzFeed India,2022-08-20,155291,7639,168,BuzzFeed India,Aug
60,Ox5ENiMatcI,We Tasted The Most Unpopular Items On The Domino's Menu | BuzzFeed India,2022-08-13,443797,16243,321,BuzzFeed India,Aug
61,L2chsN7Qvzg,We Cooked Our Favourite Recipes For Each Other | BuzzFeed India,2022-08-06,358368,16354,389,BuzzFeed India,Aug
62,9_ZUX7ca1DE,Strangers Order Food For Each Other For 24 hours | BuzzFeed India,2022-07-30,264331,12063,197,BuzzFeed India,Jul
63,6By3ObpcNRA,Who Has The Best Comfort Food? | BuzzFeed India,2022-07-23,608406,20840,493,BuzzFeed India,Jul
64,c5yfKEGs1zY,Reviewing Bollywood's Portrayal Of People With Disabilities | BuzzFeed India,2022-07-20,29713,1488,61,BuzzFeed India,Jul
65,UN3Vz6QAfrs,Does Shayan Know His Mom By Her Cooking? | BuzzFeed India,2022-07-16,274929,12624,192,BuzzFeed India,Jul
66,Lnq8fAcdAXo,Who Has The Best Monsoon Snacks? | BuzzFeed India,2022-07-09,430656,17159,794,BuzzFeed India,Jul
67,RAvf-E0e180,I Tried Recreating The McDonald's McAloo Tikki | BuzzFeed India,2022-07-02,198321,9257,184,BuzzFeed India,Jul
68,yrmB57aTNXQ,Who Has The Best Biryani Order? | BuzzFeed India,2022-06-25,545726,21238,617,BuzzFeed India,Jun
69,H7RtzobYSyo,I Swapped Diets With An Australian Chef | BuzzFeed India,2022-06-18,215102,9109,197,BuzzFeed India,Jun
70,cjsEfXyMHro,Besties Go Shopping For Pride | BuzzFeed India,2022-06-11,42009,2112,101,BuzzFeed India,Jun
71,IpWHSFQD-gU,Who Has The Best Iced Coffee Order? | BuzzFeed India,2022-06-04,276309,12160,423,BuzzFeed India,Jun
72,gghR8V6M1k0,Taste Testing Canadian Snacks | BuzzFeed India,2022-05-28,284082,11610,323,BuzzFeed India,May
73,Vlt1SbGQLwk,Foodie Vs Non Foodie Swap Diets | BuzzFeed India,2022-05-21,382510,14861,271,BuzzFeed India,May
74,cGAD7nKc_rU,Do We Know Primary School Hindi Muhavare? | BuzzFeed India,2022-05-14,120235,5665,262,BuzzFeed India,May
75,HinD9saJpUA,Turning All My Food GREEN For A Day | BuzzFeed India,2022-05-07,127538,5994,251,BuzzFeed India,May
76,lGMUcHcdPmI,We (Almost) Hate Bollywood And Here's Why | BuzzFeed India,2022-04-30,39627,1376,317,BuzzFeed India,Apr
77,gu_t1G97uIc,Taste Testing A Nostalgic Chicken Curry Dish | BuzzFeed India,2022-04-23,66514,2998,75,BuzzFeed India,Apr
78,rKDyri0amiI,We Swapped Clothes For A Week | BuzzFeed India,2022-04-16,120611,5410,125,BuzzFeed India,Apr
79,M2lWpON7mbk,Can I Find A Date Based On Maggi Recipes? | BuzzFeed India,2022-04-09,238721,10025,190,BuzzFeed India,Apr
80,hFFxOWsNoCs,DRIPPIN Members Spill The Tea | BuzzFeed India,2022-04-06,56498,2993,95,BuzzFeed India,Apr
81,h__VW6u2xpc,Work Besties Swap Favourite Foods For a Day | BuzzFeed India,2022-04-02,676803,26210,364,BuzzFeed India,Apr
82,WdszGpm7oP8,We Transformed Into Badass Women From Bollywood | BuzzFeed India,2022-03-26,122908,6286,215,BuzzFeed India,Mar
83,ewFKrNqPzWE,Why Does Bollywood Suck At Representing Women? | BuzzFeed India,2022-03-19,156476,7708,280,BuzzFeed India,Mar
84,dgWv1RiGEj4,Women Face Their Biggest Fashion Fears | BuzzFeed India,2022-03-12,150747,7301,258,BuzzFeed India,Mar
85,9ZkHtMx33sU,Can I Wear Euphoria Makeup Every Day? | BuzzFeed India,2022-03-05,115293,5652,136,BuzzFeed India,Mar
86,wO4mGKZPwv0,Can We Style Euphoria Looks from Amazon India? | BuzzFeed India,2022-02-26,82413,5065,207,BuzzFeed India,Feb
87,O7jLJ1dqwCg,We Are Live From BuzzFeed India,2022-02-19,47136,1630,35,BuzzFeed India,Feb
88,tAhL_lb3gYQ,BuzzFeed India Live Stream,2022-02-18,0,0,0,BuzzFeed India,Feb
89,B7B5V0pGz6o,Long Distance Couple Surprises Each Other For Valentine's Day | BuzzFeed India,2022-02-12,145406,8842,506,BuzzFeed India,Feb
90,RruAifFYogw,Can I Cook An Entire Kerala Sadhya By Myself? | BuzzFeed India,2022-02-09,201773,9227,533,BuzzFeed India,Feb
91,smbEraeMHpM,I Wore Emily In Paris Inspired Outfits For A Week | BuzzFeed India,2022-01-29,124121,7841,299,BuzzFeed India,Jan
92,zovJoql8HGg,Work Besties Swap Morning & Night Routines | Aishwarya and Aniket | BuzzFeed India,2022-01-22,183117,8736,200,BuzzFeed India,Jan
93,yN7KFQPb3-g,We Tried The Most Unusual Foods We Could Find | BuzzFeed India,2022-01-15,473342,18391,603,BuzzFeed India,Jan
94,RvQbL-2u1Ng,Work Friends Swap New Year Mystery Boxes | BuzzFeed India,2022-01-08,189563,11180,260,BuzzFeed India,Jan
95,dtJzFPF5d2Q,Who Has The Best New Year's Eve Order? | BuzzFeed India,2022-01-01,595640,25043,488,BuzzFeed India,Jan
96,wDGIGVph4LE,BuzzFeed India Glitching for 11 Mins Straight,2021-12-29,117516,6142,214,BuzzFeed India,Dec
97,lKESp0x_vw4,Can I Cook This Christmas Recipe From Goa? | BuzzFeed India,2021-12-25,218484,9811,264,BuzzFeed India,Dec
98,NvKDikJ7iH0,Amateur Vs Expert Christmas Makeup Challenge | BuzzFeed India,2021-12-18,138436,7361,162,BuzzFeed India,Dec
99,kKaKAdxI-hE,Who Has The Best Street Food Order? | BuzzFeed India,2021-12-11,739980,27139,804,BuzzFeed India,Dec
100,NwUlks3vejY,Can I Cook A Tamizh Thaali? | Bloopers | BuzzFeed India,2021-12-07,77620,3339,32,BuzzFeed India,Dec
101,jCXyP_mlU9Q,Can I Cook A Tamizh Thali? | BuzzFeed India,2021-12-04,306589,13824,489,BuzzFeed India,Dec
102,JruqbFQkP30,Can I Cook A Tamizh Thaali? | Teaser | BuzzFeed India #Shorts,2021-11-30,59856,2576,34,BuzzFeed India,Nov
103,zKXo0vjHNJc,Who Has The Best Wendy's Order | BuzzFeed India,2021-11-27,558980,20671,680,BuzzFeed India,Nov
104,APxbpRy7JxA,Who Has The Best Wendy's Order? | Teaser | BuzzFeed India #Shorts,2021-11-26,56365,2346,44,BuzzFeed India,Nov
105,D42HHXdLkOs,Who Has The Best Faasos Order? | Bloopers | BuzzFeed India #Shorts,2021-11-22,60347,2216,12,BuzzFeed India,Nov
106,So-QOmG9UAM,We Tested Viral Makeup Trends | BuzzFeed India,2021-11-17,184940,10146,256,BuzzFeed India,Nov
107,M2mL1LkcviU,Squid Game Challenge Pt. 2 | Shorts | BuzzFeed India #Shorts,2021-11-16,83546,3849,22,BuzzFeed India,Nov
108,-aeAgKATD2c,Squid Game Challenge Pt. 1 | Shorts | BuzzFeed India #Shorts,2021-11-16,77348,3829,23,BuzzFeed India,Nov
109,L4QnS7KB4r0,Who Has The Best Faasos Order? | BuzzFeed India,2021-11-13,626855,24110,668,BuzzFeed India,Nov
110,VoWxsxvj0VI,Who Has The Best Faasos Order? | Teaser | #Shorts | BuzzFeed India,2021-11-12,81576,3524,54,BuzzFeed India,Nov
111,dOnUmZNG0-8,We Tested Viral Makeup Trends | Bloopers | #Shorts| BuzzFeed India,2021-11-08,18435,901,18,BuzzFeed India,Nov
112,mmK1XGSOUOA,Momo Pizza or Pizza Momo? | BuzzFeed India,2021-11-06,290127,15265,299,BuzzFeed India,Nov
113,PNtUA30tsKs,Momo Pizza or Pizza Momo? | Teaser | BuzzFeed India #Shorts,2021-11-05,135319,5804,37,BuzzFeed India,Nov
114,tmsOIob_bGw,Will Sasha Survive This Soan Papdi Challenge? | #Shorts | BuzzFeed India,2021-11-05,101471,3974,37,BuzzFeed India,Nov
115,Ezx44Y4yTi8,Who Has The Best Diwali Snacks? | BuzzFeed India,2021-11-03,387224,17788,926,BuzzFeed India,Nov
116,jMc_VaepoVo,Who Has The Best Diwali Snacks Order? #Shorts,2021-11-02,54237,2413,99,BuzzFeed India,Nov
117,i32pUj0wkeU,Should I Gift Her A Carpet? | Diwali Bloopers | BuzzFeed India #Shorts,2021-11-01,42747,1941,9,BuzzFeed India,Nov
118,OmQcQJJa0xc,Bollywood Inspired Diwali Fashion Challenge | BuzzFeed India,2021-10-30,221030,13401,243,BuzzFeed India,Oct
119,SmmmdZ-Rh1A,Bollywood Inspired Diwali Fashion Challenge | Teaser | BuzzFeed India #Shorts,2021-10-29,32606,1499,26,BuzzFeed India,Oct
120,p4oFKXYp19E,We Tested Viral Makeup Trends But They Fought Back | Teaser | BuzzFeed India #Shorts,2021-10-29,94456,3641,31,BuzzFeed India,Oct
121,_yZ6MXxbTGs,Sasha Failed This Challenge | Shorts | BuzzFeed India #Shorts,2021-10-26,43932,1598,24,BuzzFeed India,Oct
122,8EQMDI0Mh4k,Aishwarya And Abinaya Struggling To Follow A Diwali Recipe In Marathi |  #Shorts | BuzzFeed India,2021-10-25,33987,1449,22,BuzzFeed India,Oct
123,sBZe-alrfCQ,Can I Follow A Diwali Recipe In Marathi? | BuzzFeed India,2021-10-23,318418,14055,454,BuzzFeed India,Oct
124,XheDg_q0qKI,This Is What Happens When Aishwarya And Abinaya Try To Cook Together |  #Shorts | BuzzFeed India,2021-10-22,62360,3050,45,BuzzFeed India,Oct
125,JMygZBKadn8,We Didn't Have Internet For A Day And This Is What We Did! | #Shorts | BuzzFeed India,2021-10-21,65805,3636,48,BuzzFeed India,Oct
126,mW5DEsL7zn8,Who Has The Best Taco Bell Blooper? | BuzzFeed India #Shorts,2021-10-18,37981,1995,23,BuzzFeed India,Oct
127,AQ19_zhD7bw,Who Has The Best Taco Bell Order? | BuzzFeed India,2021-10-16,826152,28996,904,BuzzFeed India,Oct
128,lyt4xSs1Umw,Who Has The Best Taco Bell Order? | Teaser | BuzzFeed India #Shorts,2021-10-16,34055,1800,20,BuzzFeed India,Oct
129,RBqOPhuZegA,Can Sasha Draw This Legendary Painting Blindfolded? | #Shorts | BuzzFeed India,2021-10-14,31477,1301,25,BuzzFeed India,Oct
130,Y0rGqzDVmyw,Will This Trick Your Mind? | #Shorts | BuzzFeed India,2021-10-13,47851,3388,40,BuzzFeed India,Oct
131,Lu4BhJXgmos,Will Vishal Survive This Momo Challenge? | Shorts | BuzzFeed India,2021-10-12,67392,3572,33,BuzzFeed India,Oct
132,lKDN0pBCNzg,Can I Make A South Indian Meal With Oreos? | Bloopers,2021-10-11,24410,1064,19,BuzzFeed India,Oct
133,cu9ztQ3IEE4,Can Sasha Draw This Famous Mask Blindfolded? | Shorts | BuzzFeed India,2021-10-10,33139,1517,19,BuzzFeed India,Oct
134,bYh9r-qLbVo,Can I Make A South Indian Meal With Oreos? | BuzzFeed India,2021-10-09,191091,10102,397,BuzzFeed India,Oct
135,QabY3QVVIBw,Can I Make A South Indian Meal With Oreos? | Teaser | BuzzFeed India,2021-10-08,51216,2434,62,BuzzFeed India,Oct
136,Cj0enkR4feI,Can We Style Vishal For A Job Interview? | Bloopers| BuzzFeed India,2021-10-07,22583,959,15,BuzzFeed India,Oct
137,SgzjKmvvl3g,Can We Style Vishal For A Job Interview? | Looks or Lewks? | BuzzFeed India,2021-10-06,142365,8470,269,BuzzFeed India,Oct
138,-O3rb8kAMqM,Interviewing For A Shaadi *brb* | Teaser | BuzzFeed India,2021-10-05,31515,1371,14,BuzzFeed India,Oct
139,Ap2AtQwMKe8,Who Has The Best Mad Over Bloopers? | BuzzFeed India,2021-10-04,37673,2011,34,BuzzFeed India,Oct
140,Aqiw5-aHNmg,Who Has The Best Mad Over Donuts Order? | BuzzFeed India,2021-10-02,508193,22354,730,BuzzFeed India,Oct
141,Hf9jgQ1r-n0,Who Has The Best Mad Over Donuts Order? | Teaser | BuzzFeed India,2021-10-01,57362,2866,64,BuzzFeed India,Oct
142,0NfZUV70DsM,Who Has The Best Spice Tolerance? | Shorts | BuzzFeed India,2021-09-30,63496,3362,37,BuzzFeed India,Sep
143,YpwdfRuBGFw,Can I Cook An Assamese Thali? | Bloopers | BuzzFeed India,2021-09-27,37721,1683,19,BuzzFeed India,Sep
144,1Dqhj3uGvQ8,Can I Cook An Assamese Thali? | BuzzFeed India,2021-09-25,306516,15189,541,BuzzFeed India,Sep
145,fNkqNJ_00P8,Aishwarya Struggling To Cook For 30s Straight | Teaser | BuzzFeed India,2021-09-24,72178,3046,35,BuzzFeed India,Sep
146,4ZcYO1OK_sk,Can You Text Your Boss While Blindfolded? | BuzzFeed India,2021-09-23,103172,4661,48,BuzzFeed India,Sep
147,e4hBwOJGWH4,Can You Make These Body Parts Dance? | BuzzFeed India,2021-09-22,64861,2807,61,BuzzFeed India,Sep
148,uhK2rC-RXr4,Who Has The Best Belgian Waffle Order? | BuzzFeed India,2021-09-18,592601,25066,848,BuzzFeed India,Sep
149,tXUOW_yVU6Y,Who Has The Best Belgian Waffle Order? | Teaser | BuzzFeed India,2021-09-17,59660,2878,58,BuzzFeed India,Sep
150,SDZ3Nhkf1FE,Can You Dress For First Date Only With Jockey? | Bloopers | BuzzFeed India,2021-09-17,37785,1629,17,BuzzFeed India,Sep
151,wh0sJP9toAA,Can We Ace This Bollywood Quiz? Pt 2 | Bloopers | BuzzFeed India,2021-09-16,20035,1072,31,BuzzFeed India,Sep
152,4Jf1jgfLjxs,Can We Ace This Bollywood Quiz? Part 2 | BuzzFeed India,2021-09-15,181116,10059,431,BuzzFeed India,Sep
153,vR8oZhs4ayM,Struggling To Ace This Bollywood Quiz | Teaser | BuzzFeed India,2021-09-14,33320,1607,58,BuzzFeed India,Sep
154,W5n5qY8FQjY,Modak Eating Challenge Fail | BuzzFeed India,2021-09-14,90905,3526,53,BuzzFeed India,Sep
155,qCnIriuQ6Bc,Can You Dress For A First Date Only With Jockey? | Looks or Lewks? | BuzzFeed India,2021-09-11,139517,8307,254,BuzzFeed India,Sep
156,idrVly3MAmE,Can You Dress For First Date Only With Jockey? | Teaser | BuzzFeed India,2021-09-11,40792,2290,48,BuzzFeed India,Sep
157,AO1JAzemzvo,Can You Do This With Your Tongue? #CANYOU #shorts,2021-09-09,75542,3276,77,BuzzFeed India,Sep
158,R3YLMH3zSsM,EATING A WHOLE LEMON?! #CANYOU? #shorts,2021-09-08,71966,3848,108,BuzzFeed India,Sep
159,AFf_5IRUQsQ,I Tried Alia Bhatt's Favorite Recipes | Bloopers | BuzzFeed India,2021-09-07,57921,2087,21,BuzzFeed India,Sep
160,ew4EIjgS5nM,Who Has The Best Baskin Robbins Order? | Bloopers | BuzzFeed India,2021-09-06,39745,1861,15,BuzzFeed India,Sep
161,TXwSHo_AOuw,Who Has The Best Baskin Robbins Order? | BuzzFeed India,2021-09-04,564271,24550,1020,BuzzFeed India,Sep
162,pF6rwNx237c,Who Has The Best Baskin Robbins Order? | Teaser | BuzzFeed India,2021-09-03,65355,3273,63,BuzzFeed India,Sep
163,c15FpYPHJfo,Can They Cook This Mystery Recipe? | Bloopers | BuzzFeed India,2021-09-02,31691,1306,30,BuzzFeed India,Sep
164,TEmpTTMoYfU,Can They Cook This Mystery Recipe? | Tirunelveli Halwa | BuzzFeed India,2021-09-01,268486,11370,514,BuzzFeed India,Sep
165,3jzyM6hJ5Hw,BuzzFood *Chef* Skills | Teaser | BuzzFeed India,2021-08-31,49300,2234,51,BuzzFeed India,Aug
166,YbcVi3_xVSQ,Shreya And Kartik Eat Bloopers For A Day | Bloopers | BuzzFeed India,2021-08-30,75117,2606,41,BuzzFeed India,Aug
167,StT2L6mGn-Y,I Tried Alia Bhatt's Favorite Recipes | BuzzFeed India,2021-08-28,335776,14221,520,BuzzFeed India,Aug
168,JxsHUWcn4U4,Can This North Indian Follow A Recipe In Tulu? | BuzzFeed India,2021-08-25,193028,8612,469,BuzzFeed India,Aug
169,bM-P9f_4uf0,BuzzFeed Quizzes Decide What We Eat For A Day | BuzzFeed India,2021-08-21,281217,13309,626,BuzzFeed India,Aug
170,ENgZNtIsAsE,Tasting Your Food Recommendations  Pt. 4 | BuzzFeed India,2021-08-18,178669,8360,265,BuzzFeed India,Aug
171,zSxOPZqc6Ow,BuzzFood Swap Marathon | BuzzFeed India,2021-08-14,63751,2493,118,BuzzFeed India,Aug
172,3G5ObUj-2gM,Genderless Clothes x Blooper-ful Vishal | Bloopers | BuzzFeed India,2021-08-11,48770,2452,42,BuzzFeed India,Aug
173,gYxY0-y6ajE,Can I Style Myself With Women's Section Clothes? | Looks or Lewks? | BuzzFeed India,2021-08-07,154262,11630,493,BuzzFeed India,Aug
174,2pIFZHcBJ-U,Can Shreya Pun This? | BuzzFeed India,2021-08-04,137960,5838,160,BuzzFeed India,Aug
175,uy5ILFOXxK8,Aishwarya And Vishal Trying To Speak *phrr* | Bloopers | BuzzFeed India,2021-08-02,71506,2890,55,BuzzFeed India,Aug
176,oZG-ltMjZOI,Can I Cook A Veg Maharashtrian Thali? | BuzzFeed India,2021-07-31,382569,17671,1093,BuzzFeed India,Jul
177,tN1_IQJPBls,Strangers Buy Each Other Mystery Gifts | BuzzFeed India,2021-07-24,175751,9638,353,BuzzFeed India,Jul
178,KSt8hI5RBok,Who Can Make The Best Parotta? | BuzzFeed India,2021-07-21,365076,14660,830,BuzzFeed India,Jul
179,nEFzBdCSBeY,We Made@buzzfeedlatam react to Zindagi Na Milegi Dobara | BuzzFeed India,2021-07-17,55662,2510,163,BuzzFeed India,Jul
180,v4puoRw9iDs,Tasting Your Food Recommendations Pt. 3 | BuzzFeed India,2021-07-14,164365,6235,323,BuzzFeed India,Jul
181,d5RUyhFYYtY,Can I Cook Better Than My Mom? | BuzzFeed India,2021-07-10,372986,17031,726,BuzzFeed India,Jul
182,VRKWThUlbjQ,Tasting Your Food Recommendations Pt. 2 | BuzzFeed India,2021-07-07,174542,6062,295,BuzzFeed India,Jul
183,EZeEKCDilDM,Styling Looks Inspired By K-Dramas | Looks or Lewks? | BuzzFeed India,2021-07-03,160502,9652,520,BuzzFeed India,Jul
184,6Y-ewY22cow,Indians Try To Make Japanese Bento Boxes | BuzzFeed India,2021-06-30,276184,12253,510,BuzzFeed India,Jun
185,AOYMMOWE_t8,Can We Ace This Bollywood Quiz? | BuzzFeed India,2021-06-26,292276,14523,617,BuzzFeed India,Jun
186,5Mncbd14I-s,Tasting Your Food Recommendations Pt. 1 | BuzzFeed India,2021-06-22,240745,10390,357,BuzzFeed India,Jun
187,psGjnDQa-KU,Can I Make A South Indian Meal With Maggi? | BuzzFeed India,2021-06-19,382209,16563,821,BuzzFeed India,Jun
188,ye6Mwh0CD18,We Ordered Food For Each Other For A Day | BuzzFeed India,2021-06-16,760992,30328,806,BuzzFeed India,Jun
189,h7ZWJwuv7xg,Aussies React To Om Shanti Om | BuzzFeed India | @BuzzFeedOz,2021-06-12,88682,3871,267,BuzzFeed India,Jun
190,Yg_k6xBarXk,Who Has The Best Fast Food Order? | Supercut | BuzzFeed India,2021-06-05,194881,7646,1030,BuzzFeed India,Jun
191,duq8ahDASTE,I Styled Looks With Second Hand Clothes | BuzzFeed India,2021-05-29,195811,14324,602,BuzzFeed India,May
192,DHsVNItlyXQ,I Tried Recreating The McDonald's Hash Browns | BuzzFeed India,2021-05-22,277834,13312,635,BuzzFeed India,May
193,yoaQPaI1bOE,We Tried Cooking For Our Dads | BuzzFeed India,2021-05-15,409764,17451,770,BuzzFeed India,May
194,uOwg9QrGA3g,Who Has The Best Gourmet McDonald's Order? | BuzzFeed India,2021-05-08,968692,32014,1311,BuzzFeed India,May
195,XbsVsvc5hI0,We Swapped Hometown Recipes: Bengali vs Tamilian | BuzzFeed India,2021-05-01,604804,26116,1524,BuzzFeed India,May
196,Cwz92V13PqI,We Tried Styling Outfits Inspired By The Oscars | BuzzFeed India,2021-04-27,195867,11107,615,BuzzFeed India,Apr
197,3nil1IGjKAc,We Swapped Diets For 24 Hours : India v/s Japan | BuzzFeed India,2021-04-24,623313,26056,1525,BuzzFeed India,Apr
198,Zhou2vUBGWo,We Recreated Looks From K-Pop Videos | BuzzFeed India,2021-04-17,319838,17338,2121,BuzzFeed India,Apr
199,h3lrxURQYHI,Who Has The Best Burger King Order? BuzzFeed India,2021-04-13,1145442,35272,1746,BuzzFeed India,Apr
200,AkUC3WQfZDk,We Tried Re-Creating Photos Of Our Parents | BuzzFeed India,2021-04-10,178594,8187,395,BuzzFeed India,Apr
201,mDdgnv1g18s,Who Has The Best Pizza Hut Order? | BuzzFeed India,2021-04-03,1164525,39185,1768,BuzzFeed India,Apr
202,7FGAYvGP-A8,We Tried A 15 Minute Makeup Challenge | BuzzFeed India,2021-03-30,205484,11050,490,BuzzFeed India,Mar
203,DVp1WbPpBEA,We Tried Creating Mocktails In A Budget | BuzzFeed India,2021-03-27,444493,18753,785,BuzzFeed India,Mar
204,O2olMSUP9PQ,Who Has The Best CCD Order? | BuzzFeed India,2021-03-20,921135,32056,953,BuzzFeed India,Mar
205,ZHqKr3_V5No,Do We Know Enough About The Northeast? | BuzzFeed India,2021-03-16,113329,6898,537,BuzzFeed India,Mar
206,amo0OGvgJuA,Foreigners React To Yeh Jawaani Hai Deewani | BuzzFeed India,2021-03-13,208572,10689,428,BuzzFeed India,Mar
207,_qWQtRTWICU,Taste Testing PMS Comfort Food | BuzzFeed India,2021-03-06,733145,28378,1237,BuzzFeed India,Mar
208,OPpUqHanyHk,We Tried DIY Hacks For Sustainable Fashion | BuzzFeed India,2021-02-27,299687,16188,729,BuzzFeed India,Feb
209,d9ph8qbZ1T4,Indian vs Australian Slang Battle | feat. Shayan Roy & David Warner | Presented by Tourism Australia,2021-02-23,274223,13533,457,BuzzFeed India,Feb
210,MgApqAyaB6s,Are We Eating This Right? | BuzzFeed India,2021-02-20,608105,22725,986,BuzzFeed India,Feb
211,dU26Eq98L0U,Who Has The Best KFC Order? | BuzzFeed India,2021-02-13,1505972,40363,1985,BuzzFeed India,Feb
212,-jMHRhir5H4,We Had A Valentine's Day Gift Exchange! | BuzzFeed India,2021-02-09,416693,18176,825,BuzzFeed India,Feb
