Video_id,Title,Published_date,Views,Likes,Comments,Channel_Title
1fSEMGubXuc,Library Class Implementation Exercise 4: Solution | JavaScript Tutorial In Hindi #36,2019-08-06,43562,1226,58,CodeWithHarry
FJZEVmF3eDg,Ajax tutorial in hindi | JavaScript Tutorial In Hindi #35,2019-08-05,407691,9000,456,CodeWithHarry
SWWl1o0LT1I,What is Asynchronous Programming? | JavaScript Tutorial In Hindi #34,2019-08-04,108245,4009,100,CodeWithHarry
l6i8RDrhcqM,Project 2: Building a College Library Website | JavaScript Tutorial In Hindi #33,2019-08-03,212623,5848,707,CodeWithHarry
_h8-WFuGnNo,Implementing a library class - Exercise 4 | JavaScript Tutorial In Hindi #32,2019-08-02,41286,1412,117,CodeWithHarry
YBBg6bp9ojA,ES6 Classes and Inheritance | JavaScript Tutorial In Hindi #31,2019-07-31,111569,3462,157,CodeWithHarry
azTgmrQaYl0,Prototype Inheritance In JavaScript | JavaScript Tutorial In Hindi #30,2019-07-30,83251,2324,213,CodeWithHarry
AoeFRS3cRxQ,Notes App with Title - Exercise 3: Solution | JavaScript Tutorial In Hindi #29,2019-07-29,55635,1612,112,CodeWithHarry
ihk_Xglr164,Python Tutorial In Hindi 🔥,2019-07-27,1938759,67737,9108,CodeWithHarry
nBs7t0j3x3c,Object Prototype In javascript | JavaScript Tutorial In Hindi #28,2019-07-26,104916,3022,115,CodeWithHarry
Gw2Jrid4SaQ,Docker Tutorial in Hindi,2019-07-25,443576,12599,1403,CodeWithHarry
4cuJKHNHQ-s,"Object Literals, Constructors and Object Oriented JavaScript | JavaScript Tutorial In Hindi #27",2019-07-23,117408,3879,135,CodeWithHarry
eiJwqMpF3Wg,Improving Magic Notes Website Exercise 3 | JavaScript Tutorial In Hindi #26,2019-07-22,44560,1484,121,CodeWithHarry
kk6T2-xeW5A,Creating an Editable Div Exercise 2: Solution | JavaScript Tutorial In Hindi #25,2019-07-22,78192,2158,216,CodeWithHarry
7QaZ4lehCfk,Date Object: Date & Time In JavaScript | JavaScript Tutorial In Hindi #24,2019-07-21,69608,2437,54,CodeWithHarry
IhARNbBrYrs,Math Object In JavaScript | JavaScript Tutorial In Hindi #23,2019-07-21,73769,2622,86,CodeWithHarry
kwgNsNhYcHo,Project 1: Build a Notes Taking Website Using Pure JavaScript | JavaScript Tutorial In Hindi #22,2019-07-20,297913,6104,932,CodeWithHarry
cPtIm7m4Gkg,Creating Editable Div Using JavaScript: Exercise 2 | JavaScript Tutorial In Hindi #21,2019-07-20,77922,2350,209,CodeWithHarry
xSv-9Yod83Q,Local & Session storage in JavaScript | JavaScript Tutorial In Hindi #20,2019-07-19,158135,4347,183,CodeWithHarry
vDdQ6s_yeiA,Smart Page Crawler In JS Exercise1: Solution | JavaScript Tutorial In Hindi #19,2019-07-19,98908,2866,120,CodeWithHarry
XFKvwSxWDN0,More on JavaScript Events | JavaScript Tutorial In Hindi #18,2019-07-18,97389,3201,135,CodeWithHarry
rxPw8kJUPQ0,Events & Event Object In JavaScript | JavaScript Tutorial In Hindi #17,2019-07-18,124203,3740,89,CodeWithHarry
MeCPwvMQZ9o,"Creating, Removing & Replacing Elements | JavaScript Tutorial In Hindi #16",2019-07-17,139923,3730,276,CodeWithHarry
087OGOITaKU,"Children, Parent & Traversing the DOM | JavaScript Tutorial In Hindi #15",2019-07-17,149806,4513,153,CodeWithHarry
p9V44AYNfQE,HTML Element Selectors In JavaScript | JavaScript Tutorial In Hindi #14,2019-07-16,199216,5180,189,CodeWithHarry
fXWd_DxeW9s,WebPage Crawler In JavaScript - Exercise 1 | JavaScript Tutorial In Hindi #13,2019-07-16,141839,3708,803,CodeWithHarry
vzuOQnfOk2I,Understanding DOM & Creating a Website Layout | JavaScript Tutorial In Hindi #12,2019-07-15,263533,7838,379,CodeWithHarry
36hwHnUdVAA,Manipulating Websites Using JS Window Object | JavaScript Tutorial In Hindi #11,2019-07-15,185164,6177,102,CodeWithHarry
dsV07zIGfc4,Functions in JavaScript | JavaScript Tutorial In Hindi #10,2019-07-14,224193,5930,185,CodeWithHarry
SluQIaQD4Ug,"For, While & Do while Loops in JavaScript | JavaScript Tutorial In Hindi #9",2019-07-14,190923,5473,158,CodeWithHarry
vaZpDYOuprA,If Else Conditionals & Switches in JavaScript | JavaScript Tutorial In Hindi #8,2019-07-14,178940,5231,184,CodeWithHarry
nlRtAF8Gu0A,Arrays and Objects In JavaScript | JavaScript Tutorial In Hindi #7,2019-07-13,236504,7030,209,CodeWithHarry
5H_RSfSfaRs,"Strings: Properties, Methods & Template Literals in JavaScript | JavaScript Tutorial In Hindi #6",2019-07-13,219301,6541,605,CodeWithHarry
XYFg6_V-c9Q,JavaScript Type Conversion & Coercion | JavaScript Tutorial In Hindi #5,2019-07-13,230248,7411,350,CodeWithHarry
oKuUSBqv4rg,Data Types in JavaScript (Primitive & Reference Types) | JavaScript Tutorial In Hindi #4,2019-07-12,263768,8257,279,CodeWithHarry
YKvoSoA9CPw,"Variables: let, const & var in JavaScript | JavaScript Tutorial In Hindi #3",2019-07-12,352491,9803,711,CodeWithHarry
n5Xm6us5-yU,"Console Logs, Errors, Warnings & More | JavaScript Tutorial In Hindi #2",2019-07-11,453755,10528,383,CodeWithHarry
cvvwkgp4HBg,"Installing VS Code, Extensions & Setup | JavaScript Tutorial In Hindi #1",2019-07-11,1114554,23442,3936,CodeWithHarry
wsnmhqRtFgk,Implementing Google Recaptcha In Python Django (Tutorial),2019-07-08,10397,335,78,CodeWithHarry
RhEjmHeDNoA,Python Pandas Tutorial in Hindi,2019-07-04,631998,16131,681,CodeWithHarry
Rbh1rieb3zc,Numpy Tutorial in Hindi,2019-07-03,493811,14174,557,CodeWithHarry
VxBsanSLMSA,Area of Circle In C Exercise 14 Solution: C Tutorial In Hindi #76,2019-07-02,113907,2378,370,CodeWithHarry
5tFhNUJSFrc,Memory Leak In C: C Tutorial In Hindi #75,2019-07-01,49676,1797,95,CodeWithHarry
QPACZmKLx_c,Exercise 14 Area of the Circle Using Function Pointers: C Tutorial In Hindi #74,2019-06-30,34582,925,58,CodeWithHarry
ixsfbrvoFwA,Callback Functions Using Function Pointers In C: C Tutorial In Hindi #73,2019-06-29,46109,1619,84,CodeWithHarry
TjgU8oTd61E,Function Pointers In C: C Tutorial In Hindi #72,2019-06-28,60237,2122,69,CodeWithHarry
_tCY-c-sPZc,Linux Tutorial For Beginners in Hindi,2019-06-27,1829665,58103,5555,CodeWithHarry
7G0ceg3ElqY,[Solved] Command Line Calculator In C Ex.13 : C Tutorial In Hindi #71,2019-06-25,30798,985,62,CodeWithHarry
CqRCD3Vv6xM,Command Line Calculator In C - Exercise 13: C Tutorial In Hindi #70,2019-06-23,26831,975,38,CodeWithHarry
9HcUfc6_0Oc,Automated Bill Generator In C (Solution) - Exercise 12: C Tutorial In Hindi #69,2019-06-22,49930,1431,147,CodeWithHarry
CMkymwLBSyg,Command Line Arguments In C: C Tutorial In Hindi #68,2019-06-21,89386,3175,67,CodeWithHarry
qg69AXmHhx8,"File modes, fgets, fputs, fgetc, fputc & more on C file handling: C Tutorial In Hindi #67",2019-06-20,198214,5722,259,CodeWithHarry
dJA5qWhCXvE,Automated Receipt Generator In C - Exercise 12: C Tutorial In Hindi #66,2019-06-19,36003,1151,54,CodeWithHarry
WUG2rN0cG9c,Palindrome Number Program in C Language: C Tutorial In Hindi #65,2019-06-17,72573,1947,88,CodeWithHarry
qbeKkYSMe-Y,Functions For File I/O In C Language: C Tutorial In Hindi #64,2019-06-16,98201,3348,79,CodeWithHarry
kFTwAWiQUIg,Check Palindrome In C Language - Exercise 11: C Tutorial In Hindi #63,2019-06-15,42888,1356,105,CodeWithHarry
C286MZpbNl8,File I/O In C: C Tutorial In Hindi #62,2019-06-14,83901,3407,60,CodeWithHarry
7QX_vwJMsL0,Matrix Multiplication in C - Exercise 10 Solution: C Tutorial In Hindi #61,2019-06-13,103243,2745,113,CodeWithHarry
iOTf_ZgrU20,Predefined Macros & Other Pre-processor Directives: C Tutorial In Hindi #60,2019-06-12,60142,2341,115,CodeWithHarry
qDIpHL8Al20,#define and #include Preprocessor Directives: C Tutorial In Hindi #59,2019-06-11,72229,2729,117,CodeWithHarry
itB6VsP5UnA,Project 2: Coding Flappy Bird Game (With Source Code) | Python Tutorials For Absolute Beginners #122,2019-06-10,652472,21312,3225,CodeWithHarry
P9IAfh89EK8,C Pre-processor Introduction & Working: C Tutorial In Hindi #58,2019-06-09,73957,2852,245,CodeWithHarry
bwx4gqfeJok,Matrix Multiplication In C Language - Exercise 10: C Tutorial In Hindi #57,2019-06-08,35694,1280,83,CodeWithHarry
OFeX90DiXLI,"Rock, Paper & Scissors In C Language - Exercise 9 Solution: C Tutorial In Hindi #56",2019-06-08,57945,1747,206,CodeWithHarry
zYDHG6qt_lo,Wild Pointer In C Language: C Tutorial In Hindi #55,2019-06-07,39825,1863,90,CodeWithHarry
PAgnCAMY4t8,Dangling Pointer In C Language: C Tutorial In Hindi #54,2019-06-07,57266,2369,77,CodeWithHarry
lWX0nSBxcrc,NULL Pointer In C Language: C Tutorial In Hindi #53,2019-06-06,58370,2267,50,CodeWithHarry
HQzIJJTTCBk,Void Pointer In C Language: C Tutorial In Hindi #52,2019-06-06,67118,2717,94,CodeWithHarry
23FDUZy1jJw,"Coding Rock, Paper, Scissors In C Exercise 9: C Tutorial In Hindi #51",2019-06-05,50927,1951,375,CodeWithHarry
9vbXVOE7ufg,Employee Manager In C - Exercise 8 Solution: C Tutorial In Hindi #50,2019-06-05,48145,1610,127,CodeWithHarry
0yNX8aYPBRg,"Storage Classes In C Auto, Extern, Static & Register Storage Classes: C Tutorial In Hindi #49",2019-06-04,131932,4135,112,CodeWithHarry
kBSJl6r70aA,C Language Employee Manager Exercise 8: C Tutorial In Hindi #48,2019-06-01,51274,1691,141,CodeWithHarry
q8j8EqCZcWM,Dynamic Memory Allocation Malloc Calloc Realloc & Free(): C Tutorial In Hindi #47,2019-05-30,281334,9819,373,CodeWithHarry
zx7jBJkEEt8,C Language Travel Agency Manager Exercise 7 Solution: C Tutorial In Hindi #46,2019-05-28,65633,1925,189,CodeWithHarry
kmV55hPsSQE,Memory Layout of C Programs - Dynamic Memory Allocation : C Tutorial In Hindi #45,2019-05-27,166560,5555,127,CodeWithHarry
RZ0trTpVVMM,C Language Travel Agency Manager Exercise 7: C Tutorial In Hindi #44,2019-05-26,56903,1884,238,CodeWithHarry
7uBBK6H3rTw,C Tutorial HTML Parser Exercise 6: Solution and Shoutouts: C Tutorial In Hindi #43,2019-05-25,74293,2169,243,CodeWithHarry
u98KvPuaIus,Static Variables In C: C Tutorial In Hindi #42,2019-05-24,115232,3702,133,CodeWithHarry
K_9qlP7D8ik,C Language HTML Parser Exercise 6: C Tutorial In Hindi #41,2019-05-22,74542,2199,176,CodeWithHarry
ijgm-QLEsHM,C Language Array Reversal Exercise 5: Solution: C Tutorial In Hindi #40,2019-05-21,94066,2888,227,CodeWithHarry
C3zS6WPxHPY,Unions In C: C Tutorial In Hindi #39,2019-05-20,134586,4972,721,CodeWithHarry
sxQ4hRHLVAc,Typedef In C: C Tutorial In Hindi #38,2019-05-19,121394,4625,472,CodeWithHarry
J464pe6ZTrE,Structures In C: C Tutorial In Hindi #37,2019-05-19,326367,10850,313,CodeWithHarry
FUcFssRCT70,Array Reversal In C - Exercise 5: C Tutorial In Hindi #36,2019-05-18,86350,2573,290,CodeWithHarry
L2aTSqTcJs8,String Functions In C & string.h Library: C Tutorial In Hindi #35,2019-05-18,181611,5465,258,CodeWithHarry
fltaqGek-oA,Strings In C: C Tutorial In Hindi #34,2019-05-17,279667,8445,587,CodeWithHarry
SFiRyw8R8mE,Star Pattern In C - Exercise 4 Solution: C Tutorial In Hindi #33,2019-05-17,107474,3098,124,CodeWithHarry
iaWMpHLQmDU,Passing Arrays As Function Arguments: C Tutorial In Hindi #32,2019-05-16,182277,5546,233,CodeWithHarry
6R0jNW6j2NA,Call by Value & Call By Reference In C: C Tutorial In Hindi #31,2019-05-16,244843,7564,557,CodeWithHarry
Gtlskam5ric,Exercise 4: Printing Star Patterns In C: C Tutorial In Hindi #30,2019-05-15,111882,3669,529,CodeWithHarry
L39wmuaupa8,Is Recursion Always Good? : C Tutorial In Hindi #29,2019-05-15,105601,4180,1242,CodeWithHarry
Wtoekh_12kI,Exercise 3 On Recursions: Solution + Shoutouts: C Tutorial In Hindi #28,2019-05-14,142360,3681,134,CodeWithHarry
RhLSYjDXB4Q,Arrays And Pointer Arithmetic In C: C Tutorial In Hindi #27,2019-05-13,320090,10263,563,CodeWithHarry
yGB9jhsEsr8,C++ Tutorial For Beginners: Learn C Plus Plus In Hindi,2019-05-12,2514909,98537,12542,CodeWithHarry
IBjGjDbwxSg,Pointers In C: C Tutorial In Hindi #26,2019-05-11,540184,19258,467,CodeWithHarry
-y_YOWV4kPc,Exercise 3 On Recursions: C Tutorial In Hindi #25,2019-05-10,164360,4146,324,CodeWithHarry
t90FMQr9WWc,VS Code Tutorial + Python Setup | Python Tutorials For Absolute Beginners In Hindi #121,2019-05-08,764911,30007,2127,CodeWithHarry
UUkEFH20IL4,Exercise 2: Solution + Shoutouts: C Tutorial In Hindi #24,2019-05-08,200469,4307,252,CodeWithHarry
qKFBtCPwjgI,Arrays In C: C Tutorial In Hindi #23,2019-05-07,737588,19682,377,CodeWithHarry
mLKRZg3I66g,C Exercise 2: Units and Conversions: C Tutorial In Hindi #22,2019-05-06,184633,4942,757,CodeWithHarry
P5TdIWxYz4I,Recursive Functions: Recursion In C: C Tutorial In Hindi #21,2019-05-05,456150,13906,522,CodeWithHarry
nq_999WmWTY,C Exercise 1: Multiplication Table Solution + Shoutouts: C Tutorial In Hindi #20,2019-05-05,285001,6941,291,CodeWithHarry
XNS9BgQ0dGI,Hosting Django Website On Ubuntu VPS | Python Django Tutorials In Hindi #70,2019-05-04,53479,983,183,CodeWithHarry
CSJLuARmzg0,Functions In C: C Tutorial In Hindi #19,2019-05-04,712329,18764,958,CodeWithHarry
qc7FU9jWAxk,Typecasting In C: C Tutorial In Hindi #18,2019-05-03,294957,10571,129,CodeWithHarry
AWUxfROdzPc,Goto Statement In C: C Tutorial In Hindi #17,2019-05-02,325984,15377,286,CodeWithHarry
Lp9Ftuq2sVI,Project 1: Iron Man Jarvis AI Desktop Voice Assistant | Python Tutorials For Absolute Beginners #120,2019-05-01,3146272,118420,17123,CodeWithHarry
yeH9DZlpbmM,Break and Continue Statements In C: C Tutorial In Hindi #16,2019-05-01,393881,13056,613,CodeWithHarry
T5_qpdDtTZ0,For Loop In C: C Tutorial In Hindi #15,2019-04-30,483747,16654,782,CodeWithHarry
0KzWpgMLDmk,While Loop In C: C Tutorial In Hindi #14,2019-04-29,361360,13409,260,CodeWithHarry
S2z0OTZoziI,Do While Loop In C: C Tutorial In Hindi #13,2019-04-29,495331,14694,495,CodeWithHarry
A_IgufxmIHk,Loops In C: C Tutorial In Hindi #12,2019-04-28,515924,19384,710,CodeWithHarry
E8weUIY2-iw,Switch Case Control Statements In C: C Tutorial In Hindi #11,2019-04-28,637653,18561,1220,CodeWithHarry
D0ACZ0uU_2g,If Else Control Statements In C: C Tutorial In Hindi #10,2019-04-28,779995,22704,2479,CodeWithHarry
XETsCR2bXJI,C Format Specifiers and Escape Sequences With Examples : C Tutorial In Hindi #9,2019-04-27,729459,22064,659,CodeWithHarry
c3Pd1xQlfWE,C Programming Exercise 1 - Multiplication Tables: C Tutorial In Hindi #8,2019-04-27,639169,21896,6142,CodeWithHarry
V4Wwuu05_t4,Operators In C: C Tutorial In Hindi #7,2019-04-26,1062336,30256,1097,CodeWithHarry
EcUGDTs4RyY,Variables & Data Types In C: C Tutorial In Hindi #6,2019-04-25,1032370,39199,1952,CodeWithHarry
PrVOM7M5nEY,Basic Syntax Of A C Program: C Tutorial In Hindi #5,2019-04-24,1011645,36922,3134,CodeWithHarry
5SIBB589fAg,Basic Structure of C Program in Hindi: C Tutorial In Hindi #4,2019-04-23,1647492,42367,2139,CodeWithHarry
9xCskNFVt2c,Install & Configure VS Code With C Compiler: C Tutorial In Hindi #3,2019-04-22,3576127,87564,8486,CodeWithHarry
Wa-kgmSLls4,What Is Coding & C Programming Language? : C Tutorial In Hindi #2,2019-04-21,1457135,74207,3485,CodeWithHarry
7Dh73z3icd8,Why Learn C Programming Language? : C Tutorial In Hindi #1,2019-04-20,3148502,158416,30105,CodeWithHarry
1glrtDGtjVI,Python Problem 9: Jumbled Funny Names | Python Tutorials For Absolute Beginners In Hindi #119,2019-04-20,39081,1015,251,CodeWithHarry
Dhzp7hlXJFQ,Python Problem 8: Solution | Python Tutorials For Absolute Beginners In Hindi #118,2019-04-19,18853,558,54,CodeWithHarry
S-OFpk9IQmU,Python Problem 8: Fake Multiplication Tables | Python Tutorials For Absolute Beginners In Hindi #117,2019-04-19,17942,741,170,CodeWithHarry
VkH1B0EAhfU,Python Problem 7: Solution | Python Tutorials For Absolute Beginners In Hindi #116,2019-04-18,21959,769,62,CodeWithHarry
sEZW2n2D-Hs,Python Problem 7: Creating A Search Engine | Python Tutorials For Absolute Beginners In Hindi #115,2019-04-18,40708,1408,144,CodeWithHarry
NRndfnhknSc,Python Problem 6: Solution | Python Tutorials For Absolute Beginners In Hindi #114,2019-04-17,15072,591,45,CodeWithHarry
3ePMrLWsBps,Python Problem 6 | Python Tutorials For Absolute Beginners In Hindi #113,2019-04-17,17191,691,254,CodeWithHarry
-Q57UxpBfV0,Python Problem 5: Solution | Python Tutorials For Absolute Beginners In Hindi #112,2019-04-16,15209,505,44,CodeWithHarry
H7kH_2YJQVY,Python Problem 5 | Python Tutorials For Absolute Beginners In Hindi #111,2019-04-16,17494,722,230,CodeWithHarry
o6h2kU2VTkc,Python Problem 4: Solution | Python Tutorials For Absolute Beginners In Hindi #110,2019-04-15,18915,653,69,CodeWithHarry
-7IhCwaHb2c,Python Problem 4 | Python Tutorials For Absolute Beginners In Hindi #109,2019-04-14,19629,770,246,CodeWithHarry
tx7VofKNnAA,Python Problem 3: Solution | Python Tutorials For Absolute Beginners In Hindi #108,2019-04-14,19888,704,72,CodeWithHarry
u5-K_ua9sOw,CSS 3 Tutorial For Beginners: Learn CSS In One Video In Hindi,2019-04-13,401089,12546,1127,CodeWithHarry
XiXUrvzoTIs,Python Practice 3 | Python Tutorials For Absolute Beginners In Hindi #107,2019-04-12,21467,898,219,CodeWithHarry
-aF859WfPoQ,Python Practice 2 Solution | Python Tutorials For Absolute Beginners In Hindi #106,2019-04-12,18586,783,81,CodeWithHarry
VeOPJM6yTIY,Practice Problem 2 (Easy) |  Python Tutorials For Absolute Beginners In Hindi #105,2019-04-11,24907,1046,380,CodeWithHarry
F6-RRrwWEsQ,Python Practice 1 Solution | Python Tutorials For Absolute Beginners In Hindi #104,2019-04-11,34229,914,75,CodeWithHarry
nDWMNCs8TBg,Practice Problem 1 (Easy) |  Python Tutorials For Absolute Beginners In Hindi #103,2019-04-10,61529,2162,524,CodeWithHarry
WLUCzSaH5kI,JavaScript Registration Form Validation Tutorial In Hindi - हिंदी में,2019-04-09,220105,5342,211,CodeWithHarry
osj8mxEcwRI,Reset Forgotten Admin Password In Django| Python Django Tutorials In Hindi #69,2019-04-09,26586,590,65,CodeWithHarry
qLh84CmdBJ0,[Solved] gcc is not recognized as an internal or external command operable program or batch file,2019-04-08,557796,8749,4311,CodeWithHarry
YXcgD8hRHYY,C Programming Tutorial For Beginners: Learn C In Hindi,2019-04-08,614528,18497,2826,CodeWithHarry
-al2bECumKg,Login And Registration Form Using Php & MySQL [Php Login System In Hindi],2019-04-06,259166,6078,639,CodeWithHarry
o5vKJmqXO_g,"Create A Responsive Website Using HTML, CSS And Bootstrap 4 In Hindi",2019-04-05,128789,4162,282,CodeWithHarry
uZ39tdVZNww,Fixing A Bug In Django E Commerce Website Tracker | Python Django Tutorials In Hindi #68,2019-04-04,16665,438,75,CodeWithHarry
pqikLTmaZ-k,Creating Product Search Feature In Our E Commerce Website | Python Django Tutorials In Hindi #67,2019-03-31,28457,775,109,CodeWithHarry
cdtPcTIuazI,"Integrating Payment Gateway: PayTM, UPI, Cards & NetBanking | Python Django Tutorials In Hindi #66",2019-03-31,111664,2448,609,CodeWithHarry
ZG4Wh55aYqY,"Integrating Facebook Like, Comments & Shares In Django Blog | Python Django Tutorials In Hindi #65",2019-03-30,22065,943,134,CodeWithHarry
WxckiLuzoVc,Linking Django Blog Posts To Blog Home | Python Django Tutorials In Hindi #64,2019-03-30,10811,433,59,CodeWithHarry
YFlx1C8XwR0,jQuery Tutorial For Beginners In Hindi - हिंदी में,2019-03-29,443672,13683,764,CodeWithHarry
k5UhTp_V6Dk,Social Networking Website In PHP in 5 Minutes,2019-03-26,19810,643,51,CodeWithHarry
uEHxwJmx9wc,Hosting A PHP Website Using DigitalOcean One Click Install On Ubuntu 18 (Linux+Apache+PHP+MySql),2019-03-25,3577,49,8,CodeWithHarry
M4ukzxxs3-I,Installing Wordpress On DigitalOcean VPS Droplet (Super Quick),2019-03-25,2068,69,15,CodeWithHarry
WE8PIfxEBMg,SSH Keys Deployment Tutorial On Ubuntu 18 VPS In Hindi (Password Free Login),2019-03-24,6194,227,34,CodeWithHarry
9h9iz_xFzZY,Putty Tutorial To Connect To A Digitalocean VPS Droplet(Beginner Friendly),2019-03-24,6629,144,25,CodeWithHarry
Veyw8hpe4NA,FileZilla Tutorial: Transfer Files Between Client And Remote Server Using SFTP In DigitalOcean,2019-03-23,9407,167,39,CodeWithHarry
EwugRqOvwgM,Important Apache2 Files and Directories For Web Server Administrators! | Apache2 Error/Access Logs,2019-03-23,3942,128,18,CodeWithHarry
ENseYglESfw,How to Host Flask App On Ubuntu 18 VPS Using Virtual Environment! (Python Website Hosting),2019-03-22,7566,143,31,CodeWithHarry
Jf2ps07RqoU,Hosting Multiple PHP Websites On One Single Ubuntu 18.04 DigitalOcean VPS Using Apache Server,2019-03-21,12309,283,39,CodeWithHarry
gwWKnnCMQ5c,Git & GitHub Tutorial For Beginners In Hindi - हिंदी में,2019-03-20,1762713,60723,2074,CodeWithHarry
Itqbbfdam24,How To Install PHP MyAdmin On Digital Ocean? Linux VPS Setup Guide,2019-03-06,9593,242,65,CodeWithHarry
Drel4WOq3p4,"Installing LAMP (Linux, Apache, MySQL & PHP) Stack On DigitalOcean",2019-03-05,19116,509,44,CodeWithHarry
INOh3Sks4b0,Initial Server Setup Using Digital Ocean On Ubuntu 18 VPS | Creating A Droplet + Sudo User,2019-03-03,32013,1058,137,CodeWithHarry
CiBi-hNnqEw,What is a VPS & How To Use Digital Ocean?,2019-03-02,58148,2452,84,CodeWithHarry
C5XLXRjkOAs,Django Exercise 5: Solution + Shoutouts | Python Django Tutorials In Hindi #63,2019-03-02,8131,469,32,CodeWithHarry
P80gQhWbQc4,Designing The Blog Home Page | Python Django Tutorials In Hindi #62,2019-03-01,12974,487,67,CodeWithHarry
CAvJgeyOwPY,Creating a Django Post Page For Displaying Blog Content | Python Django Tutorials In Hindi #61,2019-03-01,13379,383,49,CodeWithHarry
buBfLEkVBn0,Django Exercise 5: BlogPosts | Python Django Tutorials In Hindi #60,2019-02-28,10092,369,44,CodeWithHarry
ZYb2-U9B3oQ,Creating Models For Blog In Our E-Commerce Website | Python Django Tutorials In Hindi #59,2019-02-28,14319,391,36,CodeWithHarry
wLVmVK_7MFQ,My Awesome Cart: Creating The Blog | Python Django Tutorials In Hindi #58,2019-02-27,17594,468,20,CodeWithHarry
IRoM4o0LZjg,How To Create A Currency Converter In Python? | Python Programming Practice (Hindi),2019-02-27,60877,1557,131,CodeWithHarry
u8pBzVIdF2A,How To Create A Python HTTP Server For Web Development?,2019-02-26,56918,1586,87,CodeWithHarry
Pa9XfrrHUlo,Django Website My Awesome Cart: Pull Requests | Python Django Tutorials In Hindi #57,2019-02-26,14143,392,40,CodeWithHarry
DyyGCukZxXI,How To Find Factorial & No Of Trailing Zeros In A Factorial Of A Number In Python?,2019-02-25,46545,1701,284,CodeWithHarry
hfGYzkOdUzw,Django Website TextUtils: Pull Requests | Python Django Tutorials In Hindi #56,2019-02-25,10748,366,29,CodeWithHarry
3zBhmYSLB70,How to Create An Indian Kirana Store Calculator & Receipt Generator In Basic Python?,2019-02-24,217888,7233,1060,CodeWithHarry
8sYtQXkyDPA,Merging Blog App Into The Shop UI | Python Django Tutorials In Hindi #55,2019-02-24,17097,651,87,CodeWithHarry
J1rSK5nl098,Django Solution To Exercise 4: Display Prices  | Python Django Tutorials In Hindi #54,2019-02-23,16481,505,81,CodeWithHarry
QEyLLCy9DQk,E-Commerce Website: Displaying Order Items In Tracker | Python Django Tutorials In Hindi #53,2019-02-23,20186,609,75,CodeWithHarry
7B6YpX7c6K8,Django Exercise 4: Display Prices | Python Django Tutorials In Hindi #52,2019-02-22,14150,644,84,CodeWithHarry
Nv8z_zQVJIk,Creating Order Tracker For Customers | Python Django Tutorials In Hindi #51,2019-02-22,38980,1271,227,CodeWithHarry
ifRa-89yn1Q,Creating Database Entry For Orders | Python Django Tutorials In Hindi #50,2019-02-21,28930,1186,147,CodeWithHarry
w_8ggwWfy8Y,Adding Items On Checkout Page | Python Django Tutorials In Hindi #49,2019-02-21,25931,1058,225,CodeWithHarry
-jdN0k8RSKA,Creating The Checkout Page | Python Django Tutorials In Hindi #48,2019-02-20,23393,897,70,CodeWithHarry
cgXypi3Z3y4,Adding Checkout & ClearCart Buttons | Python Django Tutorials In Hindi #47,2019-02-20,24971,839,323,CodeWithHarry
BjzCgCL3oPI,Exercise 3: Solutions + Shoutouts | Python Django Tutorials In Hindi #46,2019-02-19,15278,1170,59,CodeWithHarry
lsld-8bSGsw,Creating A Cart In Navigation Bar As Popover | Python Django Tutorials In Hindi #45,2019-02-19,26817,790,85,CodeWithHarry
wB2FVCa_lj0,Creating Add and Remove Buttons For Items In Cart | Python Django Tutorials In Hindi #44,2019-02-18,41825,1115,222,CodeWithHarry
lnCGNTDN66w,Exercise 3: Improving Cart Of Our E commerce Website | Python Django Tutorials In Hindi #43,2019-02-18,22574,954,95,CodeWithHarry
8Q1gBr-3eBk,E Commerce Website: Creating Contact Page + Database | Python Django Tutorials In Hindi #42,2019-02-17,37242,1141,110,CodeWithHarry
qy9SlnbErxE,E Commerce Website: Creating Product Page | Python Django Tutorials In Hindi #41,2019-02-17,45084,1486,169,CodeWithHarry
fBIbsrp2dTU,Adding Cart PopOver & Other Pages Using Bootstrap | Python Django Tutorials In Hindi #40,2019-02-16,37630,1462,124,CodeWithHarry
5fCuL3H7VA0,Adding Bootstrap Row & Some CSS | Python Django Tutorials In Hindi #39,2019-02-16,29028,1338,84,CodeWithHarry
M-sMIFohu5s,Improving Slider Logic & Adding Cart Items Count | Python Django Tutorials In Hindi #38,2019-02-15,39838,1322,115,CodeWithHarry
Qzn77i6qhVE,Exercise 3: Solution + Shoutouts | Python Django Tutorials In Hindi #37,2019-02-15,25488,932,264,CodeWithHarry
3HbVQxwT29w,Creating an Online Shopping Cart Using JavaScript | Python Django Tutorials In Hindi #36,2019-02-14,61365,1517,235,CodeWithHarry
6iDW97emfB0,Category-Wise Product Display In E Commerce Website | Python Django Tutorials In Hindi #35,2019-02-14,51853,1275,230,CodeWithHarry
ukcwQVdNnMg,Showing Multiple Product Slides On Homepage | Python Django Tutorials In Hindi #34,2019-02-13,57346,1417,131,CodeWithHarry
my_i3IuAtao,Showing Products On The Homepage | Python Django Tutorials In Hindi #33,2019-02-13,84128,1809,380,CodeWithHarry
--L_SFvUxGs,Logic For Showing Products On Homepage | Python Django Tutorials In Hindi #32,2019-02-12,54120,1957,138,CodeWithHarry
R_3ReW0xLBw,Template Inheritance In Django | Python Django Tutorials In Hindi #31,2019-02-12,68445,2398,319,CodeWithHarry
WECAdQ_XEOo,Fetching Products Using Python manage.py shell | Python Django Tutorials In Hindi #30,2019-02-11,62777,1595,85,CodeWithHarry
UwvsQmuSG8U,Django Exercise 3: List the Products | Python Django Tutorials In Hindi #29,2019-02-11,52337,1510,124,CodeWithHarry
66u89Q9Sz_o,Adding Media Directory In Django | Python Django Tutorials In Hindi #28,2019-02-10,74040,1882,168,CodeWithHarry
qNYIvrQkpuI,Adding Images & Changing Models In Django | Python Django Tutorials In Hindi #27,2019-02-10,91738,2111,210,CodeWithHarry
NVoh0IZN4mQ,Designing The Homepage Of Our E-Commerce Website | Python Django Tutorials In Hindi #26,2019-02-09,120333,2910,329,CodeWithHarry
