Video_id,Title,Published_date,Views,Likes,Comments,Channel_Title
IVYV_S09a7E,We Got Tarot Card Readings for 2021 | BuzzFeed India,2021-01-23,120293,5893,447,BuzzFeed India
E0_o6fAdktI,Who Has The Best School Lunch Recipe? | BuzzFeed India,2021-01-19,1354995,40722,1951,BuzzFeed India
fGpnBg-p1p8,We Played Among Us With Our Subscribers | BuzzFeed India,2021-01-16,127168,6306,500,BuzzFeed India
8VFzMacCc2U,We Swapped Weekend Routines | BuzzFeed India,2021-01-09,567405,21637,782,BuzzFeed India
OkJ9jM9J79U,Who Has The Best Ice Cream Order? | BuzzFeed India,2021-01-02,950141,32265,2599,BuzzFeed India
gNdD2Hk9SHs,We Played Never Have I Ever: 2020 Edition | BuzzFeed India,2020-12-26,396410,17299,646,BuzzFeed India
k2fbEa1F0mY,We Tried Korean Food From K-Dramas | BuzzFeed India,2020-12-22,742565,26769,1791,BuzzFeed India
kPKC88wqHzk,We Had A Secret Santa Gift Exchange! | BuzzFeed India,2020-12-19,484769,26065,802,BuzzFeed India
6PTy0C0mqNs,Who Has The Best Subway Order? | BuzzFeed India,2020-12-12,1246512,35388,1943,BuzzFeed India
dGR8Vbi2IEA,Who Has The Best Domino's Pizza Order? | BuzzFeed India,2020-12-05,1566786,41697,2872,BuzzFeed India
BMtN8Z_ai14,Every K-Pop Lover Ever | BuzzFeed India,2020-12-01,295736,17623,2668,BuzzFeed India
gZFBV3sAqa0,We Tried The Viral Spicy Korean Fire Noodles | BuzzFeed India,2020-11-28,1032617,34487,2940,BuzzFeed India
cmANi4PllJQ,Who Has The Best Starbucks Order? | BuzzFeed India,2020-11-24,1030015,29431,1560,BuzzFeed India
gTbfTeqc4c0,We Swapped Recipes From Our Hometowns | BuzzFeed India,2020-11-21,663397,28431,2138,BuzzFeed India
JiyK87ZpC80,We Styled Each Other For Diwali | BuzzFeed India,2020-11-14,660541,28470,790,BuzzFeed India
o7nM1PfCdX0,We Tried Drawing Mehendi For The First Time | BuzzFeed India,2020-11-10,156067,7726,444,BuzzFeed India
OhUDCEVywVg,We Tried Weird Masks From Amazon | BuzzFeed India,2020-11-07,368634,15113,715,BuzzFeed India
HpXMisfh7hw,Who Has The Best McDonald's Order? | BuzzFeed India,2020-10-31,1851532,43181,2513,BuzzFeed India
cpgeDMbvWKc,Adults Try Their Childhood Candies | BuzzFeed India,2020-10-24,685906,24170,2047,BuzzFeed India
RLsT9d8kqGA,Every Makeup Lover in 2020 | BuzzFeed India,2020-10-20,236960,8424,414,BuzzFeed India
0cQQsqRufyA,We Tried Iconic Snacks From Delhi | BuzzFeed India,2020-10-17,373610,14780,1332,BuzzFeed India
HEyeityrIpE,Best Friends Swap Mystery Boxes | BuzzFeed India,2020-10-10,469276,18604,673,BuzzFeed India
4k1GnFhLW7s,Adults Try Their Favourite Childhood Snacks | BuzzFeed India,2020-10-07,1045740,37725,3346,BuzzFeed India
TQnhti43ZPg,Best Of BuzzFeed India: Cooking Challenge,2020-10-03,89288,3096,162,BuzzFeed India
oD88CN7Oa7M,We Tasted Each Other's Coffee Recipes | BuzzFeed India,2020-09-26,855603,27435,1471,BuzzFeed India
JGceXjrWY70,We Tried Snacks From Pune | BuzzFeed India,2020-09-22,235123,10473,579,BuzzFeed India
06VCO1Y-CZk,Why Is India Obsessed With Only Cricket? | BuzzFeed India,2020-09-19,52625,2282,695,BuzzFeed India
ur0DbvBjPqk,American Tastes Indian Snacks | BuzzFeed India,2020-09-12,1262214,46820,2557,BuzzFeed India
rLa1P1x-aTA,Things We Are Tired Of Hearing | BuzzFeed India Marathon,2020-09-08,516822,16484,767,BuzzFeed India
T63xKZ_MTiU,I Tested My Co-Workers Gujarati Knowledge | BuzzFeed India,2020-09-05,124212,5591,315,BuzzFeed India
L8zTesQHcqw,We Tasted Each Other's Chai Recipes | BuzzFeed India,2020-09-01,765937,23827,1164,BuzzFeed India
HcCwPjgG1_s,Indian Parents Play Never Have I Ever With Their Kids | BuzzFeed India,2020-08-29,1058111,32406,876,BuzzFeed India
QoJEWgDzteg,Indian and American Swap Snacks | BuzzFeed India,2020-08-26,3007335,98844,6076,BuzzFeed India
D7zhzVm1E3A,Behind The Scenes With Shayan Roy | BuzzFeed India,2020-08-22,103770,4677,317,BuzzFeed India
j28WmpuwoL4,My Co-Workers Try To Guess Punjabi Slang | BuzzFeed India,2020-08-18,127871,6591,316,BuzzFeed India
Oe71HbzQ6Ys,I Tried Adding Bamboo Shoot To Everyday Food | BuzzFeed India,2020-08-15,162477,8094,786,BuzzFeed India
ueYRQfV-4uU,Foreigners React To Indian TV Serials | BuzzFeed India,2020-08-08,263524,11645,844,BuzzFeed India
4P1ZMS-0_Ks,Best Of Dating | BuzzFeed India,2020-08-04,66261,2961,144,BuzzFeed India
fr5S6zjHzZk,We Tasted Each Other's Maggi Recipes | BuzzFeed India,2020-08-01,1916359,48088,3472,BuzzFeed India
tkHp5vF44Fw,Can Our Parents Guess Internet Slang? | BuzzFeed India,2020-07-28,107610,5306,373,BuzzFeed India
a7xQ06ol2-g,We Tried Non-Stop Gaming For 24 Hours | BuzzFeed India,2020-07-25,32006,1397,198,BuzzFeed India
67kSNheqKX4,Brits React To Indian Slang | BuzzFeed India,2020-07-18,235770,11152,879,BuzzFeed India
X05vMo4LJRc,Thoughts You Have When You Make The First Move | BuzzFeed India,2020-07-14,118332,7532,372,BuzzFeed India
Xl-VHh7IlUY,How To... Feat. Srishti | BuzzFeed India,2020-07-11,233997,12227,425,BuzzFeed India
RHetS5vw-PQ,I Tested My Co-worker's Marathi Knowledge,2020-07-08,132402,5778,552,BuzzFeed India
u-Q9fYy4OCA,I Tried Recreating The Domino's Garlic Bread | BuzzFeed India,2020-07-04,530496,18595,679,BuzzFeed India
Ig9VXI4nFN8,Can These Australians Guess Bollywood Movie Plots? | BuzzFeed India,2020-07-01,92952,3076,232,BuzzFeed India
1Ywm9SuWa0I,Best Of Food Challenges | BuzzFeed India,2020-06-27,519251,11448,360,BuzzFeed India
QLmmy2VE9Rc,Australians Guess Indian Slang | BuzzFeed India,2020-06-24,187889,9776,707,BuzzFeed India
FRK6Hj5kMXo,Why Is India Obsessed With Good Marks? | BuzzFeed India,2020-06-20,132741,8686,1068,BuzzFeed India
QRDEpnEiZt4,Best of BuzzFeed India,2020-06-16,171497,6871,272,BuzzFeed India
VIAHAHyQA30,The Perfect Roti Challenge Ft. Shayan Roy | BuzzFeed India,2020-06-09,310081,9291,906,BuzzFeed India
R5Rl_vbVL_M,Weirdest Things We've Ever Tried | BuzzFeed India,2020-06-06,71464,2485,74,BuzzFeed India
GMBppVMSiKg,Things You Shouldn’t Say To A Person With Anxiety | BuzzFeed India,2020-06-02,70017,5586,345,BuzzFeed India
x6FR1zy5CEY,Why Is India Obsessed With Maggi? | BuzzFeed India,2020-05-30,250697,12105,849,BuzzFeed India
ZYiOQxiUokU,Best Of BuzzFeed India Taste Tests,2020-05-26,77642,3088,83,BuzzFeed India
Oh9ghad-pbo,I Tried An Easy Dessert Recipe With Bread | BuzzFeed India,2020-05-23,409114,13931,724,BuzzFeed India
Af7G3tcEee4,I Said Only YES To My Parents For A Day | BuzzFeed India,2020-05-19,209617,7825,216,BuzzFeed India
NiJP0ftWkOQ,I Tried Making Robert Pattinson's Weird Pasta Recipe | BuzzFeed India,2020-05-15,452383,15242,586,BuzzFeed India
q-3aFSEGQ6g,5 Times Shayan Killed It As A Chef | Buzzfeed India,2020-05-12,113482,4890,152,BuzzFeed India
za4u9XSsP3c,Mom And Daughter Swap Work Routines | BuzzFeed India,2020-05-09,526184,17800,475,BuzzFeed India
bV8OvVHgkPA,Things You Love About Working From Home | BuzzFeed India,2020-05-05,91729,3546,95,BuzzFeed India
LnzMvcrhIAo,I Tried To Cook A Gourmet Meal With Eggs | BuzzFeed India,2020-04-30,293689,9291,410,BuzzFeed India
4DbEqMLqYOA,Thoughts You Have While Working From Home | BuzzFeed India,2020-04-28,86971,3661,130,BuzzFeed India
0o6UPrlzLbg,Indians Taste Test American Cereals | BuzzFeed India,2020-04-23,322993,11702,481,BuzzFeed India
DSXVJB8EIXk,Thoughts You Have When You're Bored At Home | Ft. Srishti | BuzzFeed India,2020-04-21,128745,6942,241,BuzzFeed India
BgEUHnVohQk,I Tried To Cook A Gourmet Meal With Maggi | BuzzFeed India,2020-04-18,979884,27851,1276,BuzzFeed India
LlVvNlgZ3DI,Indian Parents Take BuzzFeed Quizzes | BuzzFeed India,2020-04-16,226664,8451,152,BuzzFeed India
GDBlWS4Bl0I,Shayan's Best Worst Jokes Ever | BuzzFeed India,2020-04-14,170059,9284,228,BuzzFeed India
_GSwdx8a_so,We Made An American Give Up Toilet Paper For A Week | BuzzFeed India,2020-04-07,134819,4985,524,BuzzFeed India
AnSyN-iomo4,We Tested The Weirdest Products On Amazon | Ft. Shayan & Sonia | BuzzFeed India,2020-03-31,613812,21552,421,BuzzFeed India
VCL5Y4Mpq7Q,Indians Taste Test American Snacks | BuzzFeed India,2020-03-25,1003983,27645,1193,BuzzFeed India
diKuniM4V8k,Health Freak & Junk Food Lover Swap Diets | BuzzFeed India,2020-03-17,1872642,44620,1621,BuzzFeed India
h-IvxLMqllE,Things Only People With A Daak Naam Will Understand | Ft. Shayan Roy & Himika Bose | BuzzFeed India,2020-03-10,269786,13364,756,BuzzFeed India
dKqXzQuGKTY,Guys Try Hair Removal Products For The First Time | BuzzFeed India,2020-03-03,315046,12050,468,BuzzFeed India
afWljbE8svw,Indians Taste Test Japanese Snacks | BuzzFeed India,2020-02-25,1395470,40364,1988,BuzzFeed India
1-DM_eGBOW8,Weird Things All Makeup Addicts Can Relate To | BuzzFeed India,2020-02-19,363245,13545,374,BuzzFeed India
lok97YeE4tk,People Talk About The Weirdest Places They Hooked Up,2020-02-11,97756,3717,145,BuzzFeed India
HTGeBH9TQzI,How Many People Does It Take To Finish Mumbai's Biggest Thali?,2020-02-04,1503049,34734,1124,BuzzFeed India
9rvdH0NRbK8,Queer People Answer Questions You Are Too Afraid To Ask,2020-01-29,246198,11646,706,BuzzFeed India
NhcGTwu0DQE,Thoughts You Have While Planning A Trip | Feat. Shayan Roy,2020-01-22,115695,5591,162,BuzzFeed India
lGLY02Qv-FY,People Confess Their Most Awkward Crush Stories,2020-01-14,111188,4800,425,BuzzFeed India
Qgt7KtAYyCQ,"When You're The Competitive Friend | Ft. Andre Borges, Shayan Roy",2019-12-06,172317,6531,197,BuzzFeed India
V6IFZEd6qVc,When Your Best Friend Lives Far Away | Feat. Anjali Barot & Srishti Rindani | BuzzFeed India,2019-11-28,84365,3554,109,BuzzFeed India
0mfgjLttbcA,How Bollywood Normalised Rape Culture | BuzzFeed India,2019-11-08,387421,28770,1447,BuzzFeed India
JUTbtNqSO5c,Thoughts You Have While Getting Ready For A Wedding | Srishti | BuzzFeed India,2019-10-31,761883,26546,426,BuzzFeed India
I0ixhYnqT98,Struggles of Flirting | Ft. Shayan and Himika Bose | BuzzFeed India,2019-10-24,558775,22366,533,BuzzFeed India
hfPKhCgl9lg,Why Do People Love Old Monk So Much? | Feat. Andre | BuzzFeed India,2019-10-17,220489,7688,344,BuzzFeed India
hhqMMIlYKFs,Getting Ready For The Big Day | Feat. Srishti | BuzzFeed India,2019-10-10,267677,14286,413,BuzzFeed India
4haRxWFF79A,We Pranked Our Co-workers By Contacting Spirits | BuzzFeed India,2019-10-03,299267,13966,817,BuzzFeed India
fAxXDcM923o,Struggles Of Being A Freelancer | Feat. Shayan | BuzzFeed India,2019-09-19,350238,14788,445,BuzzFeed India
bHCRraX8TMI,We Tested The Best Sex Toys In India | BuzzFeed India,2019-09-12,407293,7871,704,BuzzFeed India
0lZR-fN9OCQ,How To Sneak Out Successfully | Ft. Sonia Thomas | BuzzFeed India,2019-09-05,149825,7295,219,BuzzFeed India
fHUC_pkWEhA,When You Don't Know How To Save Money | Ft. Srishti | BuzzFeed India,2019-08-29,822467,25998,748,BuzzFeed India
lUzBKmIGYww,Struggles Of Being A Makeup Addict | Ft. Anjali Barot | BuzzFeed India,2019-08-22,3553717,81803,1827,BuzzFeed India
hLDGzUrq4wI,Thoughts You Have When You Start A New Job | Feat. Shayan | BuzzFeed India,2019-08-15,813156,28560,658,BuzzFeed India
dHgZbb_CaBs,How Much Money Did The British Actually Take From India | Ft. Andre Borges | BuzzFeed India,2019-08-08,119011,7492,956,BuzzFeed India
2gVcwyXV1As,"When You Just Can't Stop Making Jokes | Ft. Kanan, Kaneez, Urooj & Sumukhi | BuzzFeed India",2019-08-01,262063,10575,513,BuzzFeed India
mhEUqguEXJ8,Being Single Is Great | Ft. Sonia Thomas | BuzzFeed India,2019-07-25,886451,37397,1194,BuzzFeed India
WOTOlfjmyr4,#ThrowbackThursday: I Ate Every Weird Food Combination That You Voted For || Feat. Shayan,2019-07-18,508362,17454,382,BuzzFeed India
zRiBOz9nloQ,When You're Obsessed With Harry Potter | Ft. Andre Borges | BuzzFeed India,2019-07-11,259593,12838,790,BuzzFeed India
ZKgh_-oNtbc,Struggles of an NRI from the Gulf | BuzzFeed India,2019-07-04,931936,25655,1689,BuzzFeed India
_pO6_IJkmMw,Things Gujaratis Are Tired of Hearing | BuzzFeed India,2019-06-27,1436507,38386,1269,BuzzFeed India
BWhX0w_Ngmo,I Tasted Everything From McDonald's India | BuzzFeed India,2019-06-20,2293079,55137,2113,BuzzFeed India
Au5QQY3K4Fo,If Bollywood Boys Were On Tinder Ft. Shayan & Rytasha | BuzzFeed India,2019-06-18,175848,8241,247,BuzzFeed India
ZB5CPZc2YRI,GirlsFeed S01E06 – Shaadi Nahi Ho Rahi Yaar,2019-06-16,206199,8009,504,BuzzFeed India
zrIOo7nYnjk,I Drank All My Meals For A Day Ft. Shayan | BuzzFeed India,2019-06-13,582112,24007,1311,BuzzFeed India
H7yhLW965k8,People Reveal Their Internship Horror Stories | BuzzFeed India,2019-06-06,208931,9768,434,BuzzFeed India
pi1X5ZcsTZ0,GirlsFeed S01E05 – Sex and Dating Stereotypes,2019-06-02,326934,12891,875,BuzzFeed India
f4X1h-aa5cs,Why Is India Obsessed With Savita Bhabhi? | BuzzFeed India,2019-05-30,1886087,22603,1538,BuzzFeed India
fi7cDXTimhs,When You Have A Difficult Name To Pronounce Feat. Merenla Imsong | BuzzFeed India,2019-05-23,3359435,98352,5155,BuzzFeed India
BsqdWylbwTY,How Game Of Thrones Lost The Plot In Its Last Few Seasons Ft. Andre | BuzzFeed India,2019-05-20,64928,2833,266,BuzzFeed India
dc8UEZEFm_k,GirlsFeed S01E04 — I'm Not Like Other Girls,2019-05-19,215329,9533,661,BuzzFeed India
s1H-_nfu34k,Struggles Of Living With A Roommate | BuzzFeed India,2019-05-16,666988,21395,389,BuzzFeed India
5EHVrk8L8mY,How Did Indians Make PUBG Viral Enough To Get It Banned? | BuzzFeed India,2019-05-09,158236,6567,517,BuzzFeed India
5Qm4zBPpXdU,GirlsFeed S01E03 – How Bollywood Scammed Me,2019-05-05,252343,9436,936,BuzzFeed India
5PLTveJxfpU,Is The Feminism We See Really Intersectional? | BuzzFeed India,2019-05-02,55678,2207,886,BuzzFeed India
wb4FuLi5PE8,Things Malayalees Are Tired of Hearing | BuzzFeed India,2019-04-25,2215733,64276,4209,BuzzFeed India
3Tfgt37r9sc,GirlsFeed S01E02 – How To Meet People In 2019,2019-04-21,172383,5290,356,BuzzFeed India
uIDUb9pSdsw,Desi Girls Try To Find The Perfect Foundation | BuzzFeed India,2019-04-18,680763,18808,1187,BuzzFeed India
HVzStwmFuc0,When Your Parents Start Watching Game Of Thrones Ft. Shayan | BuzzFeed India,2019-04-11,261206,10044,498,BuzzFeed India
v1Yw2kaWKUk,GirlsFeed S01E01 – The Secret Double Lives Of Indian Women,2019-04-07,386654,16347,785,BuzzFeed India
gvTAldSJPMk,Why Is TikTok So Popular In India? | Feat. Andre Borges | BuzzFeed India,2019-04-04,227047,10407,733,BuzzFeed India
jnB83oBmp9A,GirlsFeed: Trailer,2019-04-03,60835,3565,147,BuzzFeed India
tJ3W2Y9Q0Dc,Indians Test Their Spice Tolerance | BuzzFeed India,2019-03-28,2220186,46779,2488,BuzzFeed India
5DcuFzQR110,Thoughts You Have On A First Date Ft. Srishti & Andre | BuzzFeed India,2019-03-21,733030,24974,604,BuzzFeed India
x4PMYJ2PEGg,How To Dress Up (Party Edition) Ft. Srishti | BuzzFeed India,2019-03-14,1243097,56987,1014,BuzzFeed India
7m1Gtvuyns8,We Took The Ultimate '90s Quiz | BuzzFeed India,2019-03-07,998201,33852,1856,BuzzFeed India
PstPgXPr6yw,I Tried Cleaning Up Everything I Own Ft. Shayan | BuzzFeed India,2019-02-28,548754,22509,1014,BuzzFeed India
AmZvdEcQFkU,Life in early 20s Vs mid 20s Vs late 20s | BuzzFeed India,2019-02-21,201622,7308,543,BuzzFeed India
54Bg5myjcow,How To Have A Lit Valentine's Day Ft. Srishti | BuzzFeed India,2019-02-14,235865,11874,447,BuzzFeed India
BNJ4fWicoP8,Srishti & Shayan Learn Everything About K-Pop | BuzzFeed India,2019-02-07,619591,31498,7321,BuzzFeed India
R9z2cGbcXCM,People Talk About The First Time They Had Sex | BuzzFeed India,2019-01-31,1803793,35012,1316,BuzzFeed India
kBmlyoWFY2M,I Registered To Vote For The First Time | BuzzFeed India,2019-01-24,81082,3410,300,BuzzFeed India
UuLPqSPEo4I,I Tried Seven Different Methods To Wake Up Early Ft. Shayan | BuzzFeed India,2019-01-17,1081749,43643,2789,BuzzFeed India
RvHwuE0rAMU,Thoughts You Have Before A First Date Ft. Srishti | BuzzFeed India,2019-01-10,1061589,30046,639,BuzzFeed India
H4zYngTVRO4,Hello 2019! | BuzzFeed India,2019-01-03,39371,1033,67,BuzzFeed India
ZRW19n3nGA8,85 Things Women Are Tired Of | BuzzFeed India,2018-12-27,536630,32826,5400,BuzzFeed India
3NzmmAwczB8,Who Can Bake A Better Cake - Pooja Dhingra vs Srishti & Shayan | BuzzFeed India,2018-12-20,1162336,28131,762,BuzzFeed India
8JdBPVM16_8,Indian Parents Are The Biggest Trolls | BuzzFeed India,2018-12-18,454747,16737,476,BuzzFeed India
MYwqWvADdlo,When You're The Younger Sibling Ft. Srishti | BuzzFeed India,2018-12-13,924901,31520,937,BuzzFeed India
hbOBvWX75jA,Can You Pass This Basic Genitals Quiz? | BuzzFeed India,2018-12-11,434409,11468,411,BuzzFeed India
lr3jzuzE6Tc,Thoughts You Have When You Have A Crush On Someone | BuzzFeed India,2018-12-06,398808,20482,1049,BuzzFeed India
YUKgTVMkHQg,People Reveal Their Most Irrational Fears | BuzzFeed India,2018-12-04,145030,6432,859,BuzzFeed India
d8rhOasiMww,Welcome To The Roast Of You Ft. Parlour Didi | Srishti & Mallika Dua | BuzzFeed India,2018-11-29,2425843,75362,1770,BuzzFeed India
EWbEH_6acBY,When You Cry Too Easily Ft. Rytasha | BuzzFeed India,2018-11-27,352255,15538,579,BuzzFeed India
hYP8oFJB3SY,Things Transgender And Non-Binary People Are Tired Of Hearing | BuzzFeed India,2018-11-22,347968,19783,2137,BuzzFeed India
FUT5UvxM80M,Who Can Make Better Butter Chicken - Saransh Goila vs Akash | BuzzFeed India,2018-11-20,314394,8390,374,BuzzFeed India
r8BQ5DysSQY,Drunk People Try To Solve Math Problems | BuzzFeed India,2018-11-15,455985,14561,1246,BuzzFeed India
jlG6DRqmdek,Why PewDiePie Doesn't Stand A Chance Against T-Series | BuzzFeed India,2018-11-13,453035,12248,11000,BuzzFeed India
gbM9SK3F44s,Things Only People Who Live With Their Parents Understand Ft. Shayan | BuzzFeed India,2018-11-08,620215,23205,581,BuzzFeed India
2OGSkXUL5Z4,If You Were Crime Master Gogo IRL Ft. Srishti | BuzzFeed India,2018-11-06,280875,17151,670,BuzzFeed India
adEOZYlTR0A,When You're The Filmy Friend Ft. Srishti & Rytasha | BuzzFeed India,2018-11-01,299475,12388,460,BuzzFeed India
FW0ZC0U53vg,People Talk About The First Time They Masturbated | BuzzFeed India,2018-10-30,840608,16719,630,BuzzFeed India
dhAQIsczs0Q,Studying In 100 Seconds | BuzzFeed India,2018-10-25,194221,9996,605,BuzzFeed India
M_jwiM7rRhk,We Did Pilates Like Katrina Kaif For 30 Days | BuzzFeed India,2018-10-23,770226,12686,391,BuzzFeed India
bz0Fr8FyX1E,When You Take Your Wingman To A Job Interview Ft. Rytasha Rathore and Shayan Roy,2018-10-18,123086,4664,226,BuzzFeed India
jsPGjmWiNcg,How To Report Workplace Sexual Harassment,2018-10-16,68484,4015,198,BuzzFeed India
8QDFajuD8pU,How To Not Send Unsolicited Dick Pics | BuzzFeed India,2018-10-09,344151,25189,1193,BuzzFeed India
h4YgnTnfB7c,Shayan Roy Memes That Butter My Naan | BuzzFeed India,2018-10-04,462372,18215,564,BuzzFeed India
MeK_opI8bgI,We Taste Test Indian Beers | BuzzFeed India,2018-10-02,735497,20253,1408,BuzzFeed India
Nql3HB7RIfw,Shayan and Srishti Q&A | BuzzFeed India,2018-09-27,99438,2786,169,BuzzFeed India
QiOGKfPlS8k,Shayan and Srishti Q&A | BuzzFeed India,2018-09-27,0,98,0,BuzzFeed India
vEJlPfrymQU,Indians Taste Test Gulf Snacks | BuzzFeed India,2018-09-25,1643615,38748,4108,BuzzFeed India
rB8kYg5z3YA,We Tried To Get Famous On Musical.ly (TikTok) Ft. Shayan and Srishti | BuzzFeed India,2018-09-20,1064038,32819,964,BuzzFeed India
7-9VEZTkLS4,Thoughts You Have While Shopping Online Ft. Srishti | BuzzFeed India,2018-09-18,931974,36997,797,BuzzFeed India
gSZ56Ql9v5k,Childhood in 100 Seconds | BuzzFeed India,2018-09-11,551322,28710,2114,BuzzFeed India
ZKMZhrD-ot4,India Just Struck Down Section 377 And Decriminalised Gay Sex | BuzzFeed India,2018-09-06,61321,4392,425,BuzzFeed India
T4FAfr5mgpA,Men Talk About Being Bullied | BuzzFeed India,2018-09-04,348688,20121,1137,BuzzFeed India
zz1IgIqluPg,Srishti Irritates Shayan For 4 Minutes Straight | BuzzFeed India,2018-08-30,542797,22416,614,BuzzFeed India
f50Lr-puKB0,56 Things Queer Desis Are Tired Of Hearing | BuzzFeed India,2018-08-28,221732,9667,788,BuzzFeed India
VZvxhpCHa2Q,"How To Make A Viral Video Ft. Naveen Richard, Sumukhi, Srishti & Shayan | BuzzFeed India",2018-08-23,287536,11596,378,BuzzFeed India
_oE8d_-5q98,Shayan Roy Best/Worst Puns Compilation | BuzzFeed India,2018-08-21,592654,24869,736,BuzzFeed India
51oA81usZO0,I Learned How To Cook In Seven Days | Ft. Shayan Roy,2018-08-16,2827477,62441,3329,BuzzFeed India
WijRjYRMvnI,I Surprised My Grandma With A Meet And Greet | Ft. Shayan,2018-08-14,337469,23162,1060,BuzzFeed India
8sdRN6aMmwM,"If Opinions Were Sold Like Clothes Feat. Rahul Subramanian, Srishti, Shayan & Rahul Dua",2018-08-09,522948,23163,738,BuzzFeed India
GqnWKUcL2qU,There's NO WAY You're Getting Through This Entire ASMR Video [USE HEADPHONES],2018-08-07,174396,7730,960,BuzzFeed India
3KGXsWVUc1k,Why Do Women Need To Be Stripped Of Their Femininity To Be Taken Seriously As Leaders,2018-08-06,94833,6580,905,BuzzFeed India
BEL7YrIwuh8,Battle Of The Road Trip DJs Ft. Dulquer Salmaan & Mithila Palkar,2018-08-04,592711,13628,525,BuzzFeed India
sNinfTXgwoE,₹50 Dosa Vs ₹500 Dosa,2018-08-02,2615231,56896,7040,BuzzFeed India
D_168C4zF00,The Life Of An Intern Ft. Srishti,2018-07-31,466553,17733,312,BuzzFeed India
ETrr6bzobY4,I Tried Doing Make Up For The First Time Ft. Shayan Roy,2018-07-26,892841,28178,729,BuzzFeed India
jr2aq3Qu_Qs,Dhadak Is The Latest In A Long List Of Bollywood Films To Erase Caste,2018-07-25,120012,6090,1626,BuzzFeed India
LvR85PSHzHU,We Tried Quitting Sugar For 30 Days,2018-07-24,1190695,28416,1092,BuzzFeed India
wJwkIxOpqZA,Casteist Slurs You Need To Know,2018-07-23,162208,7517,1251,BuzzFeed India
TChtcYMwJZA,How To Do Makeup Ft. Srishti | BuzzFeed India,2018-07-19,3846955,162717,6445,BuzzFeed India
FbmJJVJxfCE,I Tried Breaking The Easiest World Records | Feat. Shayan Roy,2018-07-17,689540,21045,560,BuzzFeed India
1C1cVlwTz9E,"India Just Got Net Neutrality, Here's Why That's A Big Deal",2018-07-16,52966,3813,254,BuzzFeed India
AFVk56swF3U,Where To Make Out Ft. Be YouNick (BYN) & Srishti,2018-07-12,966425,35626,690,BuzzFeed India
A4kZ8Em1Qrw,Things Dark Skinned Women Are Tired Of Hearing | BuzzFeed India,2018-07-10,1459749,33597,1833,BuzzFeed India
3SDO3TMwfCE,Rote Learning Messed Me Up As An Adult,2018-07-09,100857,7431,579,BuzzFeed India
PltmgpVCv3I,How Many Balloons Does It Take To Levitate A Banana? || Feat. Shayan Roy,2018-07-05,176182,9671,538,BuzzFeed India
1ysazGKaUoQ,Struggles During The Monsoon Season | BuzzFeed India,2018-07-03,166590,6962,258,BuzzFeed India
6Cl2YppqZ0Y,Here's Why We Need To Worry About Our Privacy RIGHT NOW,2018-07-02,63352,3609,223,BuzzFeed India
ZEa9EJ_Iccc,Stages Of Falling In Love In India,2018-06-28,244133,8693,613,BuzzFeed India
w6HdW-qM3sg,Things I Want To Tell My Previous Generation,2018-06-26,305238,29201,1202,BuzzFeed India
eFQhrjVGXb0,Why Acid Attacks Are So Common In India,2018-06-25,141648,9786,844,BuzzFeed India
y76WQsafR1o,Things Punjabis Are Tired of Hearing,2018-06-21,1881223,47615,2355,BuzzFeed India
Qw1q7-DdjVY,Relationships In 100 Seconds,2018-06-19,88418,3927,168,BuzzFeed India
Y9JaIqTNfhg,Homophobia Is Costing India Billions Of Dollars Ft. Harish Iyer,2018-06-18,74031,6654,707,BuzzFeed India
BM9oO5OSZWo,I Made My Dad Rate The Weirdest Viral Videos On The Internet Ft. Shayan Roy,2018-06-17,566265,19036,803,BuzzFeed India
0lDryu-mRR0,How I Nursed A Paralysed Kitten Back To Health,2018-06-14,65103,5948,333,BuzzFeed India
pYy6cl6RZ3Y,Moving To A Big City Ft. Srishti,2018-06-12,936020,37409,1149,BuzzFeed India
ADsjk_bERoM,Andre Borges In Dialogue With Aniruddha Bahal On The Cobrapost Sting Operation,2018-06-11,15661,841,110,BuzzFeed India
i0xExZTRIiM,Women Try Sustainable Period Products Ft. Rega & Aishwarya,2018-06-07,1986120,54113,3975,BuzzFeed India
QYBTZ1DQ3pI,I Tried To Live Without Plastic For A Week,2018-06-05,285519,10740,675,BuzzFeed India
khKeiDcUYDI,How Did India Get So Obsessed With Thinness?,2018-06-04,481595,26121,2986,BuzzFeed India
MbPkM569FGk,Adults React To Their School Results,2018-05-31,1205391,38632,1766,BuzzFeed India
2Cv-bcxq01c,Why Isn't The Media Reporting About The Cobrapost Sting About How Corrupt They Are?,2018-05-30,153683,15176,1242,BuzzFeed India
HZ6_pkjj_eE,69 Second Summaries: Kabhi Khushi Kabhie Gham | BuzzFeed India,2018-05-29,235440,13725,1015,BuzzFeed India
9BQc2guo-Lg,Why Is India So Obsessed With Fair Skin?,2018-05-28,1576919,75646,9042,BuzzFeed India
fOCTf1htOTc,Indian Women Talk About Their Period,2018-05-27,146276,8309,467,BuzzFeed India
qTC_ARQbGUQ,Things That Are Only Acceptable When You’re Playing Cricket Ft. Shayan,2018-05-26,675635,24638,663,BuzzFeed India
Vsml9HntK7k,Adults Take Their Board Exams (Again) | BuzzFeed India,2018-05-24,1243695,34534,2064,BuzzFeed India
qiN4qNYisoo,People Learn Gross Pani Puri Facts While Eating Pani Puri | BuzzFeed India,2018-05-22,2177138,60481,3102,BuzzFeed India
21OlLXFGAOc,Non Consensual Porn Is A Huge Problem In India,2018-05-21,215252,13958,638,BuzzFeed India
tNJpyMP-ADw,If What You Learned In School Were Actually Useful In Real Life | Ft. Shayan & Srishti,2018-05-17,2655225,89093,2342,BuzzFeed India
jiJJQ2rzQBM,We Ate Like The Great Khali For 24 Hours,2018-05-15,1534014,27610,1316,BuzzFeed India
WEkOYKgLhAE,We Need To Stop Using Terms That Trivialise Mental Health In Casual Conversation,2018-05-14,102597,8813,590,BuzzFeed India
TfRy7sPrLo4,Things Every Indian Mother Has Said | BuzzFeed India,2018-05-13,204303,6957,542,BuzzFeed India
lwJSKjO9dlQ,When You Have A Niece Or A Nephew Ft. Srishti | BuzzFeed India,2018-05-10,1295097,39989,1029,BuzzFeed India
b6J5kjLbPGY,When You're The Mom Of Your Friend Group,2018-05-08,288255,9992,211,BuzzFeed India
RxWVXNQtU7E,Hollywood Needs To Stop Glorifying Winston Churchill,2018-05-07,216111,21510,3592,BuzzFeed India
Ex6HY5CeAfY,Three Generations Review Each Other's Favourite Hobbies,2018-05-03,809598,31296,2983,BuzzFeed India
qKmmBMHl1fE,Bigg Boss Secrets Revealed Ft. Arshi Khan,2018-05-01,4377663,74553,1476,BuzzFeed India
eKyjhZq0dZ4,If You Spoke To People Like You Speak To Your Pets,2018-04-26,706393,31875,1108,BuzzFeed India
Mcu19a5qvTQ,Thoughts You Have While Picking An Outfit Ft. Srishti,2018-04-24,936560,26582,511,BuzzFeed India
p5dMAWDq9LI,12 Ways To Sass People In Tamil Ft. Niveditha Prakasam,2018-04-19,245594,10816,762,BuzzFeed India
OM4YoOybRbc,Super Single Indian Girls Try Dating Apps,2018-04-17,941035,25961,1189,BuzzFeed India
